CAN DOI KE TOAN	 2019	 2018	 2017	 2016	 2015	Q4 2015	 2014	Q4 2014	 2013	Q4 2013	 2012	Q4 2012	 2011	Q4 2011
Tài sản ngắn hạn###Current Assets	124414	85840	107365	102589	125673	125673	120219	120219	104635	104635	84490	84490	83166	83166
Tiền và các khoản tương đương tiền###Cash and Cash Euivalents	46064	19733	7595	11398	28244	28244	42632	42632	33074	33074	36297	36297	54260	54260
Các khoản đầu tư tài chính ngắn hạn###Short term financial investment	5850	0	0	0	0	0	0	0	0	0	0	0	0	0
Các khoản phải thu ngắn hạn###Short term Account Receivables	17727	17211	18591	9392	32685	32685	12514	12514	6818	6818	12627	12627	6645	6645
Hàng tồn kho###Inventory	49978	44579	75284	72322	53195	53195	57475	57475	61100	61100	33993	33993	21790	21790
Tài sản ngắn hạn khác###Other Current Assets	4795	4317	5895	9478	11549	11549	7598	7598	3644	3644	1573	1573	472	472
Tài sản dài hạn###Non-current Assets	126192	133312	147177	160716	126052	126052	24222	24222	28955	28955	34143	34143	41090	41090
Các khoản phải thu dài hạn###Long term Account Receivable	0	0	0	0	0	0	0	0	0	0	0	0	0	0
Tài sản cố định ###Fixed assets	115346	122397	134192	146963	15175	15175	17163	16014	21722	21682	23881	23855	31536	31536
Tài sản cố định hữu hình - Giá trị hao mòn lũy kế	-139001	-125647	-112933	-99523	-86004	-86004	-81328	-81328	-74739	-74739	-69069	-69069	-60468	-60468
Tài sản cố định thuê tài chính - Giá trị hao mòn lũy kế	0	-475	-297	-119	0	0	0	0	0	0	0	0	0	0
Tài sản cố định vô hình - Giá trị hao mòn lũy kế	-1279	-1205	-1131	-1057	-984	-984	-910	-910	-836	-836	-799	-799	-799	-799
Lợi thế thương mại	0	0	0	0	0	0	0	0	0	0	0	0	0	0
Bất động sản đầu tư ###Real Estate Investment	0	0	0	0	0	0	0	0	0	0	0	0	0	0
Các khoản đầu tư tài chính dài hạn###Long term Finacial Investments	0	0	0	0	0	0	0	0	0	0	0	0	0	0
Tài sản dài hạn khác###Other long term assets	10742	10902	12251	13712	7850	7850	7059	7059	7232	7232	10262	10262	9554	9554
TỔNG CỘNG TÀI SẢN ###TOTAL ASSETS	250607	219152	254542	263305	251725	251725	144441	144441	133590	133590	118633	118633	124257	124257
Nợ phải trả ###Liabilities	196347	170765	207477	193599	182877	182877	74733	74733	62495	62495	55116	55116	56752	56752
Nợ ngắn hạn###Short term Liabilities	145001	108966	132663	106577	114304	114304	74733	74733	62495	62495	54239	54239	53842	53842
Nợ dài hạn###Long term Liabilities	51346	61799	74815	87022	68573	68573	0	0	0	0	877	877	2910	2910
Dự phòng nghiệp vụ	0	0	0	0	0	0	0	0	0	0	0	0	0	0
No khac	0	0	0	0	0	0	0	0	0	0	0	0	0	0
Vốn chủ sở hữu ###Owners equity	54259	48387	47064	69706	68848	68848	69708	69708	71095	71095	63517	63517	67504	67504
Nguồn kinh phí và quỹ khác###Expenditures and Other Funds	0	0	0	0	0	0	0	0	0	0	0	0	0	0
Vốn chủ sở hữu ###Owners equity	54259	48387	47064	69706	68848	68848	69708	69708	71095	71095	63517	63517	67504	67504
Lợi ích của cổ đông thiểu số	0	0	0	0	0	0	0	0	0	0	0	0	0	0
TỔNG CỘNG NGUỒN VỐN ###TOTAL EQUITY	0	0	0	0	0	0	0	0	0	0	0	0	0	0



KET QUA KINH DOANH	 2019	 2018	 2017	 2016	 2015	 2014	 2013	 2012	 2011
Tổng doanh thu hoạt động kinh doanh###Gross Sale Revenues	368667	351299	311735	335985	286040	257841	262601	158320	95935
Các khoản giảm trừ doanh thu###Deduction revenues	0	0	2731	0	293	1038	0	3	0
Doanh thu thuần###Net Sales	368667	351299	309004	335985	285747	256803	262601	158316	95935
Giá vốn hàng bán###Cost of goods sold	312502	293915	272641	280648	232665	214023	209003	128723	76593
Lợi nhuận gộp###Gross profit	56165	57385	36362	55337	53082	42779	53597	29593	19342
Doanh thu hoạt động tài chính###Financial activities Revenues	2318	1652	898	2768	3265	2254	2777	3072	4312
Chi phí tài chính###Financial Expenses	9907	11896	12855	13570	5578	1248	1038	1410	2670
Chi phí bán hàng###Selling Expenses	22936	26035	26994	23701	25485	23245	23309	9586	5964
Chi phí quản lý doanh nghiệp###Managing Expenses	19746	19605	16018	16977	11440	10878	14720	8674	5839
Lợi nhuận thuần từ hoạt động kinh doanh###Net Profit from Operating activities	5895	1500	-18607	3858	13843	9662	17307	12995	9182
Thu nhập khác###Other incomes	214	74	47	5024	1160	2812	2314	2598	60
Chi phí khác###Other Expenses	236	251	62	3683	61	143	67	584	3
Lợi nhuận khác###Other profits	-22	-178	-15	1341	1099	2669	2246	2015	57
Tổng lợi nhuận kế toán trước thuế###Total profit before tax	5873	1322	-18622	5199	14942	12331	19554	15010	9239
Chi phí thuế TNDN###Corporate Income Tax Expenses	0	0	0	677	3235	2424	4384	2738	1522
Chi phí thuế TNDN###Corporate Income Tax Expenses	0	0	0	677	3235	2424	4384	2738	1522
Chi phí thuế TNDN###Corporate Income Tax Expenses	0	0	0	0	0	0	0	0	0
Lợi nhuận sau thuế thu nhập doanh nghiệp###Profit after Corporate Income Tax	5873	1322	-18622	4522	11708	9907	15170	12272	7717
---Cac Chi So Tai Chinh---									
EBITDA	0.00	0.00	0.00	0.00	0.00	0.00	0.00	0.00	0.00
Giá giao dịch cuối quý###Last Price of Quarter	9.50	9.50	9.00	15.18	0.00	0.00	0.00	0.00	0.00
