CAN DOI KE TOAN	 2019	 2018	 2017	 2016	Q4 2016	 2015	Q4 2015	 2014	Q4 2014	Q2 2014	 2013	Q4 2013	Q3 2013	Q2 2013	Q1 2013	 2012	 2011	 2010	 2009
Tài sản ngắn hạn###Current Assets	35562	43776	51949	49436	49436	38243	38243	41438	41438	45490	39052	39052	53403	48725	33435	36319	40503	41908	23221
Tiền và các khoản tương đương tiền###Cash and Cash Euivalents	3603	987	2193	199	199	3669	3669	4685	4685	5701	9055	9055	15542	12719	686	3164	8408	5013	1372
Các khoản đầu tư tài chính ngắn hạn###Short term financial investment	0	0	0	0	0	0	0	0	0	0	0	0	0	0	0	0	0	0	0
Các khoản phải thu ngắn hạn###Short term Account Receivables	5310	12795	17107	14552	14552	6884	6884	6888	6888	12093	5903	5903	12916	13369	8919	12544	9749	17125	3905
Hàng tồn kho###Inventory	25967	29366	32649	34108	34108	27090	27090	27254	27254	21971	20950	20950	19850	18092	23022	19402	20117	18589	16591
Tài sản ngắn hạn khác###Other Current Assets	681	628	0	578	578	599	599	2611	2611	5725	3144	3144	5095	4544	807	1209	2230	1180	1353
Tài sản dài hạn###Non-current Assets	202869	214005	237568	235915	235915	250807	250807	272514	272514	246005	228823	228823	220264	210070	194606	188416	165551	172562	172693
Các khoản phải thu dài hạn###Long term Account Receivable	0	0	657	0	0	0	0	0	0	0	0	0	0	0	0	0	0	0	0
Tài sản cố định ###Fixed assets	177640	188646	212040	211136	211136	222034	222034	255099	253439	77119	206323	86993	63187	67954	172106	165916	102265	112734	149039
Tài sản cố định hữu hình - Giá trị hao mòn lũy kế	-345495	-321773	-300234	-277057	-277057	-255056	-255056	-241236	-241236	-227517	-214533	-214533	-209699	-203395	-197189	-190052	-166133	-140635	-116249
Tài sản cố định thuê tài chính - Giá trị hao mòn lũy kế	0	0	0	0	0	0	0	0	0	0	0	0	0	0	0	0	0	0	0
Tài sản cố định vô hình - Giá trị hao mòn lũy kế	-2802	-2424	-1954	-1814	-1814	-1668	-1668	-1533	-1533	0	-1429	-1429	0	0	0	-1085	0	-485	-225
Lợi thế thương mại	0	0	0	0	0	0	0	0	0	0	0	0	0	0	0	0	0	0	0
Bất động sản đầu tư ###Real Estate Investment	0	0	0	0	0	0	0	0	0	0	0	0	0	0	0	0	0	0	0
Các khoản đầu tư tài chính dài hạn###Long term Finacial Investments	18310	15522	15187	15187	15187	16233	16233	14666	14666	22500	22500	22500	22500	22500	22500	22500	22500	22500	18000
Tài sản dài hạn khác###Other long term assets	6919	6606	9684	6234	6234	4037	4037	2749	2749	728	0	0	0	0	0	0	0	0	5653
TỔNG CỘNG TÀI SẢN ###TOTAL ASSETS	238431	257782	289516	285351	285351	289051	289051	313952	313952	291495	267875	267875	273667	258795	228040	224736	206054	214471	195914
Nợ phải trả ###Liabilities	81519	101685	132586	127855	127855	132015	132015	154179	154179	138104	104030	104030	114403	109588	86196	65812	49155	62814	73122
Nợ ngắn hạn###Short term Liabilities	63900	82789	111984	105861	105861	87176	87176	86244	86244	64643	50524	50524	44511	56595	54701	37541	28043	44573	41392
Nợ dài hạn###Long term Liabilities	17618	18896	20601	21994	21994	44839	44839	67936	67936	73460	53505	53505	69892	52993	31495	28271	21112	18240	31730
Dự phòng nghiệp vụ	0	0	0	0	0	0	0	0	0	0	0	0	0	0	0	0	0	0	0
No khac	0	0	0	0	0	0	0	0	0	0	0	0	0	0	0	0	0	0	0
Vốn chủ sở hữu ###Owners equity	156912	156096	156931	157496	157496	157036	157036	159773	159773	153392	163845	163845	159264	149207	141844	158924	156899	151657	122792
Nguồn kinh phí và quỹ khác###Expenditures and Other Funds	0	0	0	0	0	0	0	0	0	0	0	0	0	0	0	0	0	0	0
Vốn chủ sở hữu ###Owners equity	156912	156096	156931	157496	157496	157036	157036	159773	159773	153392	163845	163845	159264	149207	141844	158924	156899	151657	122792
Lợi ích của cổ đông thiểu số	0	0	0	0	0	0	0	0	0	0	0	0	0	0	0	0	0	0	0
TỔNG CỘNG NGUỒN VỐN ###TOTAL EQUITY	0	0	0	0	0	0	0	0	0	0	0	0	0	0	0	0	0	0	0



KET QUA KINH DOANH	 2019	 2018	 2017	 2016	 2015	 2014	 2013	Q3 2013	Q2 2013	Q1 2013	 2012	Q1 2012	 2011	 2010	 2009
Tổng doanh thu hoạt động kinh doanh###Gross Sale Revenues	212713	216808	230772	247168	251881	365498	347938	112222	118124	43490	343862	27672	329158	350496	364531
Các khoản giảm trừ doanh thu###Deduction revenues	0	0	0	0	0	126876	121132	38349	40966	15912	104287	8446	100103	106728	124597
Doanh thu thuần###Net Sales	212713	216808	230772	247168	251881	238623	226806	73873	77157	27578	239575	19226	229055	243769	239934
Giá vốn hàng bán###Cost of goods sold	156934	172123	181128	194579	202416	180632	168436	50781	54466	25759	180680	19236	171310	175433	183778
Lợi nhuận gộp###Gross profit	55779	44685	49644	52589	49465	57990	58370	23093	22691	1819	58895	-10	57745	68335	56155
Doanh thu hoạt động tài chính###Financial activities Revenues	27	22	11	17	111	117	582	235	24	7	960	40	1438	409	482
Chi phí tài chính###Financial Expenses	1279	4301	5476	6612	5265	10635	969	18	-93	934	1263	545	3919	4330	6078
Chi phí bán hàng###Selling Expenses	22412	22623	25810	25383	26940	21293	19793	5005	6541	2963	18817	3046	15025	15467	9759
Chi phí quản lý doanh nghiệp###Managing Expenses	29535	15858	15397	17152	17832	15454	15103	5324	7937	2007	16708	1762	13297	15570	13121
Lợi nhuận thuần từ hoạt động kinh doanh###Net Profit from Operating activities	2580	1924	2972	3460	-461	10726	23086	12981	8329	-4079	23066	-5323	26942	33378	27679
Thu nhập khác###Other incomes	2948	3146	1417	2684	5428	1931	1415	187	191	96	1607	50	599	654	689
Chi phí khác###Other Expenses	3	648	11	496	134	1047	918	132	0	246	616	2	285	58	796
Lợi nhuận khác###Other profits	2945	2498	1406	2188	5294	884	497	55	191	-150	991	49	314	596	-107
Tổng lợi nhuận kế toán trước thuế###Total profit before tax	5525	4422	4378	5648	4834	11610	23584	13036	8520	-4229	24057	-5274	27256	33974	27573
Chi phí thuế TNDN###Corporate Income Tax Expenses	1186	964	865	1207	1087	2736	6035	3259	1073	0	6176	0	6820	8500	2445
Chi phí thuế TNDN###Corporate Income Tax Expenses	1186	964	865	1207	1087	2736	6035	3259	1073	0	6176	0	6820	8500	2445
Chi phí thuế TNDN###Corporate Income Tax Expenses	0	0	0	0	0	0	0	0	0	0	0	0	0	0	0
Lợi nhuận sau thuế thu nhập doanh nghiệp###Profit after Corporate Income Tax	4339	3458	3513	4440	3746	8873	17549	9777	7447	-4229	17881	-5274	20436	25474	25128
---Cac Chi So Tai Chinh---															
EBITDA	0.00	0.00	0.00	0.00	0.00	0.00	0.00	0.00	0.00	0.00	0.00	0.00	0.00	0.00	0.00
Giá giao dịch cuối quý###Last Price of Quarter	8.55	5.21	9.20	12.74	9.83	4.22	6.25	8.13	8.06	11.18	0.00	0.00	0.00	0.00	0.00
