CAN DOI KE TOAN	Q2 2020	Q1 2020	 2019	Q4 2019	Q3 2019	Q2 2019	Q1 2019	 2018	Q4 2018	Q3 2018	 2017
Tài sản ngắn hạn###Current Assets	107635	105464	104873	104873	105322	106030	106653	106265	106265	107126	107792
Tiền và các khoản tương đương tiền###Cash and Cash Euivalents	4816	2068	843	843	529	822	825	67	67	867	1667
Các khoản đầu tư tài chính ngắn hạn###Short term financial investment	0	0	0	0	0	0	0	0	0	0	0
Các khoản phải thu ngắn hạn###Short term Account Receivables	6668	6732	6652	6652	6741	6527	6544	6492	6492	6584	6476
Hàng tồn kho###Inventory	0	0	0	0	0	0	0	0	0	0	0
Tài sản ngắn hạn khác###Other Current Assets	96151	96664	97379	97379	98052	98681	99284	99706	99706	99675	99649
Tài sản dài hạn###Non-current Assets	1369399	1277196	1298019	1298019	1318843	1339667	1360491	1381315	1381315	1351606	1270942
Các khoản phải thu dài hạn###Long term Account Receivable	0	0	0	0	0	0	0	0	0	0	0
Tài sản cố định ###Fixed assets	1369399	1277196	1298019	1298019	1318843	1339667	1360491	0	0	0	0
Tài sản cố định hữu hình - Giá trị hao mòn lũy kế	-11916	-104119	-83295	-83295	-62472	-41648	-20824	0	0	0	0
Tài sản cố định thuê tài chính - Giá trị hao mòn lũy kế	0	0	0	0	0	0	0	0	0	0	0
Tài sản cố định vô hình - Giá trị hao mòn lũy kế	0	0	0	0	0	0	0	0	0	0	0
Lợi thế thương mại	0	0	0	0	0	0	0	0	0	0	0
Bất động sản đầu tư ###Real Estate Investment	0	0	0	0	0	0	0	0	0	0	0
Các khoản đầu tư tài chính dài hạn###Long term Finacial Investments	0	0	0	0	0	0	0	0	0	0	0
Tài sản dài hạn khác###Other long term assets	0	0	0	0	0	0	0	0	0	0	0
TỔNG CỘNG TÀI SẢN ###TOTAL ASSETS	1477033	1382660	1402893	1402893	1424166	1445697	1467144	1487580	1487580	1458731	1378734
Nợ phải trả ###Liabilities	1136437	1108124	1087450	1087450	1152250	1131432	1110647	1087580	1087580	1058731	1104903
Nợ ngắn hạn###Short term Liabilities	137313	89700	65026	65026	125826	101008	76224	49156	49156	16307	58479
Nợ dài hạn###Long term Liabilities	999124	1018424	1022424	1022424	1026424	1030424	1034424	1038424	1038424	1042424	1046424
Dự phòng nghiệp vụ	0	0	0	0	0	0	0	0	0	0	0
No khac	0	0	0	0	0	0	0	0	0	0	0
Vốn chủ sở hữu ###Owners equity	340596	274535	315443	315443	271916	314265	356496	400000	400000	400000	273831
Nguồn kinh phí và quỹ khác###Expenditures and Other Funds	0	0	0	0	0	0	0	0	0	0	0
Vốn chủ sở hữu ###Owners equity	340596	274535	315443	315443	271916	314265	356496	400000	400000	400000	273831
Lợi ích của cổ đông thiểu số	0	0	0	0	0	0	0	0	0	0	0
TỔNG CỘNG NGUỒN VỐN ###TOTAL EQUITY	0	0	0	0	0	0	0	0	0	0	0



KET QUA KINH DOANH	Q2 2020	Q1 2020	 2019	Q4 2019	Q3 2019	Q2 2019	Q1 2019	Q4 2018
Tổng doanh thu hoạt động kinh doanh###Gross Sale Revenues	5359	7218	24005	6899	6415	6314	4377	0
Các khoản giảm trừ doanh thu###Deduction revenues	0	0	0	0	0	0	0	0
Doanh thu thuần###Net Sales	5359	7218	24005	6899	6415	6314	4377	0
Giá vốn hàng bán###Cost of goods sold	-14940	21328	85222	21278	21275	21311	21358	0
Lợi nhuận gộp###Gross profit	20299	-14109	-61218	-14379	-14860	-14997	-16981	0
Doanh thu hoạt động tài chính###Financial activities Revenues	0	0	1	0	0	0	0	0
Chi phí tài chính###Financial Expenses	26742	26620	106994	26722	27193	26837	26241	0
Chi phí bán hàng###Selling Expenses	0	0	0	0	0	0	0	0
Chi phí quản lý doanh nghiệp###Managing Expenses	335	179	1346	371	297	397	281	0
Lợi nhuận thuần từ hoạt động kinh doanh###Net Profit from Operating activities	-6779	-40908	-169557	-41472	-42350	-42231	-43504	0
Thu nhập khác###Other incomes	0	0	0	0	0	0	0	0
Chi phí khác###Other Expenses	0	0	0	0	0	0	0	0
Lợi nhuận khác###Other profits	0	0	0	0	0	0	0	0
Tổng lợi nhuận kế toán trước thuế###Total profit before tax	-6779	-40908	-169557	-41472	-42350	-42231	-43504	0
Chi phí thuế TNDN###Corporate Income Tax Expenses	0	0	0	0	0	0	0	0
Chi phí thuế TNDN###Corporate Income Tax Expenses	0	0	0	0	0	0	0	0
Chi phí thuế TNDN###Corporate Income Tax Expenses	0	0	0	0	0	0	0	0
Lợi nhuận sau thuế thu nhập doanh nghiệp###Profit after Corporate Income Tax	-6779	-40908	-169557	-41472	-42350	-42231	-43504	0
---Cac Chi So Tai Chinh---								
EBITDA	0.00	0.00	0.00	0.00	0.00	0.00	0.00	0.00
Giá giao dịch cuối quý###Last Price of Quarter	51.00	55.70	55.90	55.90	53.70	55.40	52.20	0.00
