CAN DOI KE TOAN	 2019	Q1 2019	 2018	Q2 2018	Q1 2018	 2017	Q4 2017	Q3 2017	Q2 2017	 2016	 2015	Q4 2015	 2014	Q4 2014	 2013	 2012
Tài sản ngắn hạn###Current Assets	470889	533933	581653	552839	459289	490541	490541	477524	442236	346158	308703	308703	194203	194203	178930	73332
Tiền và các khoản tương đương tiền###Cash and Cash Euivalents	35375	29992	48178	38798	49934	75332	75332	65474	73796	76188	55845	55845	21724	21724	14024	4698
Các khoản đầu tư tài chính ngắn hạn###Short term financial investment	0	0	0	0	0	0	0	0	0	0	5000	5000	0	0	1000	1000
Các khoản phải thu ngắn hạn###Short term Account Receivables	301489	318985	323722	284850	253107	245274	245274	224224	210765	138298	109843	109843	93561	93561	108727	55049
Hàng tồn kho###Inventory	134025	184057	207592	226094	155421	167900	167900	184425	157675	131672	138016	138016	78798	78798	54156	11709
Tài sản ngắn hạn khác###Other Current Assets	0	899	2161	3097	828	2035	2035	3401	0	0	0	0	120	120	1023	876
Tài sản dài hạn###Non-current Assets	238492	235076	235170	185364	168850	156230	156230	122201	109804	101916	85566	85566	106547	106547	102632	67954
Các khoản phải thu dài hạn###Long term Account Receivable	295	0	295	3725	0	295	295	0	2	5002	0	0	0	0	0	0
Tài sản cố định ###Fixed assets	190721	191019	191762	79950	80565	81048	81048	74606	71020	64374	53439	53439	46374	46374	43583	2867
Tài sản cố định hữu hình - Giá trị hao mòn lũy kế	-116319	-101939	-97713	-89031	-86049	-83380	-83380	-80723	-78050	-73004	-65292	-65292	-58960	-58960	-53285	-24530
Tài sản cố định thuê tài chính - Giá trị hao mòn lũy kế	-1162	-760	-626	-358	-223	-89	-89	0	0	0	0	0	0	0	0	0
Tài sản cố định vô hình - Giá trị hao mòn lũy kế	-71	-66	-64	-63	-63	-63	-63	-61	-59	-55	-46	-46	-38	-38	-30	0
Lợi thế thương mại	0	0	0	0	0	0	0	0	0	0	0	0	0	0	0	0
Bất động sản đầu tư ###Real Estate Investment	1000	1000	1000	1000	1000	1000	1000	1000	1000	1000	0	0	0	0	0	0
Các khoản đầu tư tài chính dài hạn###Long term Finacial Investments	4104	4694	4694	5227	5227	5227	5227	6881	6881	6854	6690	6690	33233	33233	34028	65087
Tài sản dài hạn khác###Other long term assets	35811	36413	37270	23559	22274	22955	22955	23253	23514	24175	23769	23769	22917	22917	25022	0
TỔNG CỘNG TÀI SẢN ###TOTAL ASSETS	709382	769010	816824	738203	628139	646771	646771	599726	552040	448074	394269	394269	300750	300750	281562	141285
Nợ phải trả ###Liabilities	452130	514722	575600	504738	398563	424701	424701	384471	345259	258087	225074	225074	146283	146283	145993	52864
Nợ ngắn hạn###Short term Liabilities	409700	468616	536901	471041	366689	414283	414283	382883	343212	257691	224103	224103	144451	144451	143553	52864
Nợ dài hạn###Long term Liabilities	42431	46106	38699	33697	31874	10418	10418	1588	2047	396	971	971	1832	1832	2440	0
Dự phòng nghiệp vụ	0	0	0	0	0	0	0	0	0	0	0	0	0	0	0	0
No khac	0	0	0	0	0	0	0	0	0	0	0	0	0	0	0	0
Vốn chủ sở hữu ###Owners equity	257251	254288	241224	233465	229576	222070	222070	215255	206781	189987	169195	169195	154467	154467	97948	88422
Nguồn kinh phí và quỹ khác###Expenditures and Other Funds	0	0	0	0	0	0	0	0	0	0	0	0	0	0	0	0
Vốn chủ sở hữu ###Owners equity	257251	254288	241224	233465	229576	222070	222070	215255	206781	189987	169195	169195	154467	154467	97948	88422
Lợi ích của cổ đông thiểu số	0	0	0	0	0	0	0	0	0	0	0	0	0	0	37621	0
TỔNG CỘNG NGUỒN VỐN ###TOTAL EQUITY	0	0	0	0	0	0	0	0	0	0	0	0	0	0	0	0



KET QUA KINH DOANH	 2019	Q1 2019	 2018	Q2 2018	Q1 2018	 2017	Q4 2017	Q3 2017	 2016	 2015	 2014	 2013	 2012
Tổng doanh thu hoạt động kinh doanh###Gross Sale Revenues	929511	252321	951861	215626	152839	966645	292232	234386	774467	627367	397965	305087	133037
Các khoản giảm trừ doanh thu###Deduction revenues	0	0	225	0	0	0	0	0	0	0	0	0	0
Doanh thu thuần###Net Sales	929511	252321	951636	215626	152839	966645	292232	234386	774467	627367	397965	305087	133037
Giá vốn hàng bán###Cost of goods sold	821532	225594	853031	189221	134768	850058	260727	203238	658167	531358	337358	256989	112703
Lợi nhuận gộp###Gross profit	107980	26727	98605	26405	18070	116587	31504	31148	116300	96010	60607	48098	20334
Doanh thu hoạt động tài chính###Financial activities Revenues	742	138	2006	379	393	2633	809	553	2617	944	126	-85	1586
Chi phí tài chính###Financial Expenses	12657	2810	9088	856	2493	6422	2660	1178	5390	5545	4996	8306	5434
Chi phí bán hàng###Selling Expenses	10023	769	1472	1992	613	8711	1865	2725	12165	7151	5203	3533	1663
Chi phí quản lý doanh nghiệp###Managing Expenses	37568	7454	40756	12054	5975	43761	14188	9397	47479	40812	21812	30447	13270
Lợi nhuận thuần từ hoạt động kinh doanh###Net Profit from Operating activities	47884	15831	48658	11882	9383	58703	11977	18401	54017	44697	29166	5727	1552
Thu nhập khác###Other incomes	2060	511	645	469	0	437	423	14	689	750	773	611	1756
Chi phí khác###Other Expenses	140	13	106	49	1	294	151	-1	318	1092	324	856	3
Lợi nhuận khác###Other profits	1920	499	539	421	-1	142	272	15	371	-342	449	-245	1754
Tổng lợi nhuận kế toán trước thuế###Total profit before tax	49804	16330	49197	12303	9382	58846	12249	18416	54388	44355	29616	6350	3306
Chi phí thuế TNDN###Corporate Income Tax Expenses	10216	3287	10024	2554	1866	11973	2651	3608	11068	10925	6389	1903	458
Chi phí thuế TNDN###Corporate Income Tax Expenses	10098	3266	10004	2546	1874	11981	2659	3608	11309	10320	4281	1691	458
Chi phí thuế TNDN###Corporate Income Tax Expenses	118	21	21	8	-8	-8	-8	0	-241	605	2108	212	0
Lợi nhuận sau thuế thu nhập doanh nghiệp###Profit after Corporate Income Tax	48770	16833	49491	12971	8313	59056	11956	19011	54183	40576	28141	4947	2847
---Cac Chi So Tai Chinh---													
EBITDA	0.00	0.00	0.00	0.00	0.00	0.00	0.00	0.00	0.00	0.00	0.00	0.00	0.00
Giá giao dịch cuối quý###Last Price of Quarter	16.30	12.73	12.73	12.72	14.39	13.97	13.97	12.97	0.00	0.00	0.00	0.00	0.00
