CAN DOI KE TOAN	 2019	 2018	 2017	 2016	 2015	Q4 2015	 2014	Q4 2014	 2013	Q4 2013	 2012	Q4 2012	 2011	Q4 2011	 2010	Q4 2010	 2009	Q4 2009
Tài sản ngắn hạn###Current Assets	367781	343483	295947	288332	616717	616717	438891	438891	419935	419935	346527	346527	343102	343102	268665	268665	212034	212034
Tiền và các khoản tương đương tiền###Cash and Cash Euivalents	45198	37030	50416	20338	72627	72627	51930	51930	55490	55490	40497	40497	42708	42708	30172	30172	69949	69949
Các khoản đầu tư tài chính ngắn hạn###Short term financial investment	0	0	0	650	2800	2800	2800	2800	1300	1300	1300	1300	1300	1300	1300	1300	0	0
Các khoản phải thu ngắn hạn###Short term Account Receivables	200809	219805	175638	202105	310892	310892	166090	166090	133914	133914	108666	108666	188755	188755	124295	124295	72819	72819
Hàng tồn kho###Inventory	112057	76329	60374	57907	220746	220746	176536	176536	192422	192422	151122	151122	86278	86278	90628	90628	50458	50458
Tài sản ngắn hạn khác###Other Current Assets	9718	10319	9519	7332	9652	9652	41534	41534	36808	36808	44942	44942	24061	24061	22270	22270	17507	17507
Tài sản dài hạn###Non-current Assets	111035	115403	98351	56202	75219	75219	67780	67780	80791	80791	90196	90196	68673	68673	65909	65909	30022	30022
Các khoản phải thu dài hạn###Long term Account Receivable	11239	13693	16886	6714	6754	6754	0	0	0	0	0	0	0	0	0	0	0	0
Tài sản cố định ###Fixed assets	46643	50065	42807	10625	34627	34627	45201	44128	50353	49463	60044	57193	41880	41880	43120	43120	23937	23937
Tài sản cố định hữu hình - Giá trị hao mòn lũy kế	-62221	-55327	-48117	-43395	-91574	-91574	-76494	-76494	-61433	-61433	-47746	-47746	-37638	-37638	-26687	-26687	-19404	-19404
Tài sản cố định thuê tài chính - Giá trị hao mòn lũy kế	0	0	0	0	0	0	0	0	-1099	-1099	-958	-958	0	0	0	0	0	0
Tài sản cố định vô hình - Giá trị hao mòn lũy kế	0	0	0	0	0	0	0	0	0	0	0	0	0	0	0	0	0	0
Lợi thế thương mại	0	0	0	0	0	0	0	0	0	0	0	0	0	0	0	0	0	0
Bất động sản đầu tư ###Real Estate Investment	0	0	0	0	0	0	0	0	0	0	0	0	0	0	0	0	0	0
Các khoản đầu tư tài chính dài hạn###Long term Finacial Investments	0	0	0	0	0	0	0	0	2500	2500	0	0	0	0	30	30	30	30
Tài sản dài hạn khác###Other long term assets	40348	44033	35121	16668	32741	32741	22578	22578	27938	27938	30152	30152	26363	26363	22671	22671	6055	6055
TỔNG CỘNG TÀI SẢN ###TOTAL ASSETS	478816	458886	394298	344534	691935	691935	506671	506671	500725	500725	436722	436722	411775	411775	334574	334574	242056	242056
Nợ phải trả ###Liabilities	354601	337739	271802	215713	543805	543805	384791	384791	385778	385778	326176	326176	306233	306233	241491	241491	182190	182190
Nợ ngắn hạn###Short term Liabilities	326752	288190	234199	195715	524505	524505	379828	379828	379710	379710	316848	316848	296181	296181	231504	231504	178866	178866
Nợ dài hạn###Long term Liabilities	27849	49548	37602	19998	19300	19300	4963	4963	6068	6068	9327	9327	10052	10052	9986	9986	3324	3324
Dự phòng nghiệp vụ	0	0	0	0	0	0	0	0	0	0	0	0	0	0	0	0	0	0
No khac	0	0	0	0	0	0	0	0	0	0	0	0	0	0	0	0	0	0
Vốn chủ sở hữu ###Owners equity	124215	121148	122496	128820	148130	148130	105267	121880	101171	114947	96561	110547	105542	105542	93083	93083	52127	52127
Nguồn kinh phí và quỹ khác###Expenditures and Other Funds	0	0	0	0	0	0	0	0	0	0	0	0	0	0	0	0	0	0
Vốn chủ sở hữu ###Owners equity	124215	121148	122496	128820	148130	148130	105267	121880	101171	114947	96561	110547	105542	105542	93083	93083	52127	52127
Lợi ích của cổ đông thiểu số	0	0	0	0	0	0	0	16613	13776	13776	13986	13986	10792	10792	12072	12072	7739	7739
TỔNG CỘNG NGUỒN VỐN ###TOTAL EQUITY	0	0	0	0	0	0	0	0	0	0	0	0	0	0	0	0	0	0



KET QUA KINH DOANH	 2019	 2018	 2017	 2016	 2015	 2014	 2013	 2012	 2011	 2010	 2009
Tổng doanh thu hoạt động kinh doanh###Gross Sale Revenues	230894	288664	175497	429177	560585	485917	533356	334487	300429	254957	249060
Các khoản giảm trừ doanh thu###Deduction revenues	0	0	0	0	0	0	0	0	0	0	0
Doanh thu thuần###Net Sales	230894	288664	175497	429177	560585	485917	533356	334487	300429	254957	249060
Giá vốn hàng bán###Cost of goods sold	210855	259505	162880	386316	508689	434161	476274	294512	258226	219484	209066
Lợi nhuận gộp###Gross profit	20039	29159	12617	42861	51896	51756	57082	39975	42202	35473	39994
Doanh thu hoạt động tài chính###Financial activities Revenues	100	182	60	4120	652	519	478	775	1463	1518	462
Chi phí tài chính###Financial Expenses	5836	9479	5216	11677	16255	16554	16115	13437	16864	6256	1970
Chi phí bán hàng###Selling Expenses	0	0	0	0	0	0	0	0	0	0	0
Chi phí quản lý doanh nghiệp###Managing Expenses	10075	14113	3211	18774	16502	24436	20763	15934	11143	11199	9022
Lợi nhuận thuần từ hoạt động kinh doanh###Net Profit from Operating activities	4227	5749	4250	16530	19791	11285	20682	11379	15658	19536	29464
Thu nhập khác###Other incomes	423	3278	392	1327	752	2933	5630	21710	2435	1681	3555
Chi phí khác###Other Expenses	213	2637	145	4026	530	2929	2444	13329	1528	793	1321
Lợi nhuận khác###Other profits	210	641	247	-2698	222	4	3187	8381	907	887	2234
Tổng lợi nhuận kế toán trước thuế###Total profit before tax	4437	6390	4497	13832	20013	11288	23868	19760	16565	20423	31698
Chi phí thuế TNDN###Corporate Income Tax Expenses	393	477	954	2859	4678	2900	6606	3954	2935	3021	4473
Chi phí thuế TNDN###Corporate Income Tax Expenses	393	477	954	2859	4064	4105	6606	4400	2935	3037	5117
Chi phí thuế TNDN###Corporate Income Tax Expenses	0	0	0	0	614	-1205	0	-445	0	-16	-644
Lợi nhuận sau thuế thu nhập doanh nghiệp###Profit after Corporate Income Tax	4258	5989	3603	11514	17694	10175	19634	15806	13630	17402	27225
---Cac Chi So Tai Chinh---											
EBITDA	0.00	0.00	0.00	0.00	0.00	0.00	0.00	0.00	0.00	0.00	0.00
Giá giao dịch cuối quý###Last Price of Quarter	9.20	7.60	6.33	5.16	9.49	2.41	1.66	0.90	3.11	1.85	0.00
