CAN DOI KE TOAN	 2019	 2018	 2017	 2016	Q4 2016	Q3 2016	Q2 2016	 2015	Q4 2015	 2014	Q4 2014	 2013	 2012	 2010	Q4 2010	 2009
Tài sản ngắn hạn###Current Assets	152801	160062	115244	83245	83245	89445	91029	66120	66120	51366	51366	3137089	85472	36297	36297	33260
Tiền và các khoản tương đương tiền###Cash and Cash Euivalents	1705	11148	62	4832	4832	442	3322	442	442	119	119	39735	1057	229	229	542
Các khoản đầu tư tài chính ngắn hạn###Short term financial investment	0	0	0	0	0	0	0	0	0	0	0	0	0	0	0	0
Các khoản phải thu ngắn hạn###Short term Account Receivables	80629	84371	66738	34874	34874	39396	54833	20816	20816	26497	26497	1089422	49504	17068	17068	7735
Hàng tồn kho###Inventory	70396	63747	47788	43446	43446	48287	31720	43466	43466	24471	24471	1972122	33564	15752	15752	21810
Tài sản ngắn hạn khác###Other Current Assets	70	797	655	92	92	1320	1156	1397	1397	279	279	35811	1347	3248	3248	3173
Tài sản dài hạn###Non-current Assets	29212	36227	21890	6626	6626	7375	8345	4815	4815	2200	2200	1494977	3899	5308	5308	7234
Các khoản phải thu dài hạn###Long term Account Receivable	0	0	0	0	0	0	0	0	0	0	0	0	0	0	0	0
Tài sản cố định ###Fixed assets	23112	23479	14908	4718	4718	4789	4412	2161	2161	729	729	300705	3105	3235	3235	5569
Tài sản cố định hữu hình - Giá trị hao mòn lũy kế	-18714	-15904	-14409	-13780	-13780	-13607	-13415	-13147	-13147	-17000	-17000	-151220	-19438	-19731	-19731	-18941
Tài sản cố định thuê tài chính - Giá trị hao mòn lũy kế	0	0	0	0	0	0	0	0	0	0	0	-70	0	0	0	0
Tài sản cố định vô hình - Giá trị hao mòn lũy kế	-56	-56	-56	-56	-56	-56	-56	-56	-56	-56	-56	-620	-56	-55	-55	-44
Lợi thế thương mại	0	0	0	0	0	0	0	0	0	0	0	0	0	0	0	0
Bất động sản đầu tư ###Real Estate Investment	0	0	0	0	0	0	0	0	0	0	0	0	0	0	0	0
Các khoản đầu tư tài chính dài hạn###Long term Finacial Investments	0	0	0	0	0	0	0	0	0	0	0	1130083	0	0	0	0
Tài sản dài hạn khác###Other long term assets	4841	11489	6895	1908	1908	2586	3412	2558	2558	206	206	64188	794	615	615	1016
TỔNG CỘNG TÀI SẢN ###TOTAL ASSETS	182013	196289	137134	89871	89871	96820	99375	70935	70935	53566	53566	4632065	89372	41605	41605	40493
Nợ phải trả ###Liabilities	139858	155865	114669	73964	73964	85925	89636	63278	63278	49144	49144	2213151	89252	51595	51595	54028
Nợ ngắn hạn###Short term Liabilities	138626	152135	113669	73964	73964	85925	89636	63278	63278	49144	49144	1512450	89252	51595	51595	48836
Nợ dài hạn###Long term Liabilities	1231	3730	1000	0	0	0	0	0	0	0	0	700701	0	0	0	5192
Dự phòng nghiệp vụ	0	0	0	0	0	0	0	0	0	0	0	0	0	0	0	0
No khac	0	0	0	0	0	0	0	0	0	0	0	0	0	0	0	0
Vốn chủ sở hữu ###Owners equity	42156	40424	22465	15907	15907	10895	9738	7657	7657	4422	4422	2373690	120	-9990	-9990	-13535
Nguồn kinh phí và quỹ khác###Expenditures and Other Funds	0	0	0	0	0	0	0	0	0	0	0	0	0	0	0	0
Vốn chủ sở hữu ###Owners equity	42156	40424	22465	15907	15907	10895	9738	7657	7657	4422	4422	2373690	120	-9990	-9990	-13535
Lợi ích của cổ đông thiểu số	0	0	0	0	0	0	0	0	0	0	0	45224	0	0	0	0
TỔNG CỘNG NGUỒN VỐN ###TOTAL EQUITY	0	0	0	0	0	0	0	0	0	0	0	0	0	0	0	0



KET QUA KINH DOANH	 2019	 2018	 2017	 2016	Q3 2016	Q2 2016	 2015	Q3 2015	 2014	 2013	 2012	 2010	 2009
Tổng doanh thu hoạt động kinh doanh###Gross Sale Revenues	285482	224896	216363	200194	24075	67124	105883	17974	80823	85032	117811	114969	111036
Các khoản giảm trừ doanh thu###Deduction revenues	0	922	1356	0	0	0	0	0	0	0	0	0	47
Doanh thu thuần###Net Sales	285482	223974	215007	200194	24075	67124	105883	17974	80823	85032	117811	114969	110989
Giá vốn hàng bán###Cost of goods sold	261850	208454	194583	179885	20708	63173	94570	15277	69504	74515	98330	105000	100715
Lợi nhuận gộp###Gross profit	23632	15521	20424	20310	3366	3951	11313	2697	11319	10516	19481	9969	10274
Doanh thu hoạt động tài chính###Financial activities Revenues	2	4	6	279	13	184	742	4	4	5	10	33	16
Chi phí tài chính###Financial Expenses	5643	4947	3753	2854	636	852	2453	661	1832	2278	5030	2797	3276
Chi phí bán hàng###Selling Expenses	0	0	0	0	0	0	0	0	263	0	16	0	0
Chi phí quản lý doanh nghiệp###Managing Expenses	8868	8171	8144	6830	1466	1519	5847	1504	6199	5764	5783	3693	3169
Lợi nhuận thuần từ hoạt động kinh doanh###Net Profit from Operating activities	9123	2407	8533	10904	1278	1763	3754	536	3029	2479	8662	3512	3846
Thu nhập khác###Other incomes	376	7460	219	261	224	-10	871	672	493	128	1047	659	223
Chi phí khác###Other Expenses	151	160	435	189	47	4	406	57	989	426	1253	626	116
Lợi nhuận khác###Other profits	224	7300	-216	72	177	-14	465	615	-496	-297	-206	33	107
Tổng lợi nhuận kế toán trước thuế###Total profit before tax	9347	9707	8317	10977	1455	1749	4218	1151	2533	2182	8456	3545	3952
Chi phí thuế TNDN###Corporate Income Tax Expenses	1905	1985	1702	2255	298	359	983	266	581	0	0	0	0
Chi phí thuế TNDN###Corporate Income Tax Expenses	1905	1985	1702	2255	298	359	983	266	581	0	0	0	0
Chi phí thuế TNDN###Corporate Income Tax Expenses	0	0	0	0	0	0	0	0	0	0	0	0	0
Lợi nhuận sau thuế thu nhập doanh nghiệp###Profit after Corporate Income Tax	7442	7722	6615	8722	1157	1390	3235	886	1952	2182	8456	3545	3952
---Cac Chi So Tai Chinh---													
EBITDA	0.00	0.00	0.00	0.00	0.00	0.00	0.00	0.00	0.00	0.00	0.00	0.00	0.00
Giá giao dịch cuối quý###Last Price of Quarter	6.37	7.78	8.25	1.73	1.79	0.00	0.00	0.00	0.00	0.00	0.00	0.00	0.00
