CAN DOI KE TOAN	 2019	Q1 2019	 2018	Q4 2018	Q2 2018	Q1 2018	 2017	 2016	 2015	 2014
Tài sản ngắn hạn###Current Assets	12502	7360	9929	5202	8328	11158	11177	8761	19980	1215
Tiền và các khoản tương đương tiền###Cash and Cash Euivalents	241	4908	433	391	804	815	566	980	2924	398
Các khoản đầu tư tài chính ngắn hạn###Short term financial investment	0	0	0	0	0	0	0	0	0	0
Các khoản phải thu ngắn hạn###Short term Account Receivables	11737	1936	8978	4293	6966	9821	10090	7104	15409	63
Hàng tồn kho###Inventory	517	517	518	518	521	521	521	521	635	635
Tài sản ngắn hạn khác###Other Current Assets	7	0	0	0	36	0	0	156	1014	119
Tài sản dài hạn###Non-current Assets	106648	112497	108134	112869	108898	108987	109280	110347	9269	12816
Các khoản phải thu dài hạn###Long term Account Receivable	79	79	79	79	79	79	0	0	0	0
Tài sản cố định ###Fixed assets	621	944	1052	1052	1267	1375	1482	1913	9269	12816
Tài sản cố định hữu hình - Giá trị hao mòn lũy kế	-2393	-2070	-1962	-1962	-1747	-1639	-1532	-1101	-11719	-9901
Tài sản cố định thuê tài chính - Giá trị hao mòn lũy kế	0	0	0	0	0	0	0	0	0	0
Tài sản cố định vô hình - Giá trị hao mòn lũy kế	0	0	0	0	0	0	0	0	0	0
Lợi thế thương mại	0	0	0	0	0	0	0	0	0	0
Bất động sản đầu tư ###Real Estate Investment	90682	91474	91738	91738	92267	92531	92795	93851	0	0
Các khoản đầu tư tài chính dài hạn###Long term Finacial Investments	0	19317	0	20000	20	0	0	0	0	0
Tài sản dài hạn khác###Other long term assets	0	0	0	0	0	0	0	0	0	0
TỔNG CỘNG TÀI SẢN ###TOTAL ASSETS	119150	119857	118064	118071	117226	120145	120458	119108	29250	14031
Nợ phải trả ###Liabilities	2762	4016	2773	2773	2560	5575	6353	5084	11304	4631
Nợ ngắn hạn###Short term Liabilities	343	1596	542	354	203	3202	6236	2774	398	2431
Nợ dài hạn###Long term Liabilities	2419	2419	2231	2419	2357	2373	117	2310	10905	2200
Dự phòng nghiệp vụ	0	0	0	0	0	0	0	0	0	0
No khac	0	0	0	0	0	0	0	0	0	0
Vốn chủ sở hữu ###Owners equity	116388	115842	115291	115298	114666	114570	114105	114024	17946	9400
Nguồn kinh phí và quỹ khác###Expenditures and Other Funds	0	0	0	0	0	0	0	0	0	0
Vốn chủ sở hữu ###Owners equity	116388	115842	115291	115298	114666	114570	114105	114024	17946	9400
Lợi ích của cổ đông thiểu số	0	0	0	0	0	0	0	0	0	0
TỔNG CỘNG NGUỒN VỐN ###TOTAL EQUITY	0	0	0	0	0	0	0	0	0	0



KET QUA KINH DOANH	 2019	Q2 2019	Q1 2019	 2018	Q4 2018	Q3 2018	Q2 2018	Q1 2018	 2017	Q1 2017	 2016	 2015	 2014
Tổng doanh thu hoạt động kinh doanh###Gross Sale Revenues	7574	1860	1902	6919	1803	1594	1851	1672	18560	2292	21877	5579	5908
Các khoản giảm trừ doanh thu###Deduction revenues	0	0	0	0	0	0	0	0	0	0	0	0	0
Doanh thu thuần###Net Sales	7574	1860	1902	6919	1803	1594	1851	1672	18560	2292	21877	5579	5908
Giá vốn hàng bán###Cost of goods sold	2010	524	477	2009	511	515	516	466	14171	451	15391	1961	0
Lợi nhuận gộp###Gross profit	5564	1335	1425	4910	1292	1078	1334	1206	4389	1841	6486	3618	5908
Doanh thu hoạt động tài chính###Financial activities Revenues	1	0	0	6	0	5	0	0	1	0	3	1	1
Chi phí tài chính###Financial Expenses	98	0	0	0	0	0	0	0	0	0	60	204	181
Chi phí bán hàng###Selling Expenses	0	0	0	0	0	0	0	0	0	0	0	0	0
Chi phí quản lý doanh nghiệp###Managing Expenses	4153	834	774	3545	789	853	1155	741	2958	490	2336	3512	5660
Lợi nhuận thuần từ hoạt động kinh doanh###Net Profit from Operating activities	1314	501	652	1371	503	230	179	465	1432	1351	4093	-97	69
Thu nhập khác###Other incomes	0	0	-108	0	0	45	0	0	0	0	278	144	218
Chi phí khác###Other Expenses	23	0	0	0	45	0	0	0	408	0	0	0	257
Lợi nhuận khác###Other profits	-23	0	-108	0	-45	45	0	0	-408	0	278	144	-39
Tổng lợi nhuận kế toán trước thuế###Total profit before tax	1292	501	544	1371	459	275	179	465	1024	1351	4371	47	30
Chi phí thuế TNDN###Corporate Income Tax Expenses	195	76	0	185	101	0	84	0	944	0	793	0	0
Chi phí thuế TNDN###Corporate Income Tax Expenses	195	76	0	185	101	0	84	0	944	0	793	0	0
Chi phí thuế TNDN###Corporate Income Tax Expenses	0	0	0	0	0	0	0	0	0	0	0	0	0
Lợi nhuận sau thuế thu nhập doanh nghiệp###Profit after Corporate Income Tax	1097	425	544	1186	357	275	96	465	81	1351	3578	47	30
---Cac Chi So Tai Chinh---													
EBITDA	0.00	0.00	0.00	0.00	0.00	0.00	0.00	0.00	0.00	0.00	0.00	0.00	0.00
Giá giao dịch cuối quý###Last Price of Quarter	10.00	13.50	22.45	22.45	22.45	22.45	10.60	12.43	0.00	0.00	0.00	0.00	0.00
