CAN DOI KE TOAN	Q2 2020	Q1 2020	 2019	Q4 2019	Q3 2019	Q2 2019	Q1 2019	 2018	Q4 2018	Q3 2018	Q2 2018	Q1 2018	 2017	Q4 2017	 2016	 2015	 2014
Tài sản ngắn hạn###Current Assets	934900	932921	960729	960729	871693	940692	1020118	1035364	1035392	949714	972463	899729	886335	886335	713591	544882	388072
Tiền và các khoản tương đương tiền###Cash and Cash Euivalents	476009	420208	432713	432713	280474	257827	242641	355404	355432	271371	412638	416038	292900	292900	570417	422255	265562
Các khoản đầu tư tài chính ngắn hạn###Short term financial investment	375984	443385	429534	429534	508552	601178	714278	622467	622467	623049	495879	427440	514972	514972	87000	37250	4000
Các khoản phải thu ngắn hạn###Short term Account Receivables	78178	62967	92076	92076	76547	74667	56525	50782	50782	50578	57920	49787	72380	72380	50115	80251	95308
Hàng tồn kho###Inventory	535	614	769	769	404	877	1019	1073	1073	1035	633	654	416	416	326	374	1376
Tài sản ngắn hạn khác###Other Current Assets	4194	5747	5637	5637	5717	6142	5655	5638	5638	3680	5393	5810	5666	5666	5734	4752	21825
Tài sản dài hạn###Non-current Assets	60810	62329	62503	62503	63769	65156	65253	67451	67451	69709	67421	69444	69503	69503	74243	94123	99586
Các khoản phải thu dài hạn###Long term Account Receivable	2180	2180	2180	2180	2180	2180	2180	2180	2180	2180	2180	2180	2262	2262	3240	1478	0
Tài sản cố định ###Fixed assets	8354	8957	8125	8125	8718	9277	8215	9489	9489	10974	8217	9325	8236	8236	10049	15476	20715
Tài sản cố định hữu hình - Giá trị hao mòn lũy kế	-78012	-77338	-76711	-76711	-76081	-75441	-74633	-73359	-73359	-71832	-71719	-70927	-69619	-69619	-64282	-59014	-57963
Tài sản cố định thuê tài chính - Giá trị hao mòn lũy kế	0	0	0	0	0	0	0	0	0	0	0	0	0	0	0	0	0
Tài sản cố định vô hình - Giá trị hao mòn lũy kế	-703	-703	-703	-703	-703	-703	-703	-703	-703	-703	-703	-703	-703	-703	-703	-603	-1527
Lợi thế thương mại	0	0	0	0	0	0	0	0	0	0	0	0	0	0	0	0	0
Bất động sản đầu tư ###Real Estate Investment	0	0	0	0	0	0	0	0	0	0	0	0	0	0	0	0	0
Các khoản đầu tư tài chính dài hạn###Long term Finacial Investments	0	0	0	0	0	0	54858	0	0	0	0	0	0	0	0	1352	4705
Tài sản dài hạn khác###Other long term assets	50276	51193	52198	52198	52871	53700	0	55783	55783	56555	57024	57940	59005	59005	60954	75817	74166
TỔNG CỘNG TÀI SẢN ###TOTAL ASSETS	995710	995250	1023233	1023233	935462	1005849	1085371	1102815	1102843	1019422	1039884	969174	955838	955838	787834	639005	487658
Nợ phải trả ###Liabilities	271890	244555	309764	309764	276223	256393	289583	274876	274903	274484	318833	315115	343208	343208	330199	217164	133768
Nợ ngắn hạn###Short term Liabilities	271890	244555	309764	309764	276223	256393	289583	274876	274903	274484	318833	315115	343208	343208	330199	217164	109814
Nợ dài hạn###Long term Liabilities	0	0	0	0	0	0	0	0	0	0	0	0	0	0	0	0	23953
Dự phòng nghiệp vụ	0	0	0	0	0	0	0	0	0	0	0	0	0	0	0	0	0
No khac	0	0	0	0	0	0	0	0	0	0	0	0	0	0	0	0	0
Vốn chủ sở hữu ###Owners equity	723820	750694	713469	713469	659239	749456	795787	827940	827940	744938	721051	654058	612631	612631	457636	421841	338582
Nguồn kinh phí và quỹ khác###Expenditures and Other Funds	0	0	0	0	0	0	0	0	0	0	0	0	0	0	0	0	0
Vốn chủ sở hữu ###Owners equity	723820	750694	713469	713469	659239	749456	795787	827940	827940	744938	721051	654058	612631	612631	457636	421841	338582
Lợi ích của cổ đông thiểu số	0	0	0	0	0	0	0	0	0	0	0	0	0	0	0	0	15308
TỔNG CỘNG NGUỒN VỐN ###TOTAL EQUITY	0	0	0	0	0	0	0	0	0	0	0	0	0	0	0	0	0



KET QUA KINH DOANH	Q2 2020	Q1 2020	 2019	Q4 2019	Q3 2019	Q2 2019	Q1 2019	 2018	Q4 2018	Q3 2018	Q2 2018	Q1 2018	 2017	 2016	 2015
Tổng doanh thu hoạt động kinh doanh###Gross Sale Revenues	118875	102967	621536	192078	157732	156896	114829	549452	167792	138981	132119	110560	531270	499474	449187
Các khoản giảm trừ doanh thu###Deduction revenues	431	102	12619	10953	1152	336	178	11610	8243	1558	394	1416	11702	9446	636
Doanh thu thuần###Net Sales	118443	102865	608916	181125	156580	156560	114651	537841	159550	137423	131725	109144	519568	490028	448551
Giá vốn hàng bán###Cost of goods sold	38969	35722	160549	45619	38829	42368	33733	117662	31539	30755	27171	28197	90699	89043	165994
Lợi nhuận gộp###Gross profit	79475	67143	448367	135506	117751	114192	80918	420180	128011	106668	104554	80947	428869	400985	282558
Doanh thu hoạt động tài chính###Financial activities Revenues	17707	4488	50237	22767	13215	14001	3718	51839	23667	15365	8841	4454	37911	59441	14055
Chi phí tài chính###Financial Expenses	0	0	110	268	306	-54	54	0	387	57	44	0	93	387	555
Chi phí bán hàng###Selling Expenses	21114	14811	53832	19991	12732	11450	9660	42999	15499	10273	7948	9279	19963	28291	29005
Chi phí quản lý doanh nghiệp###Managing Expenses	16951	11009	122362	38167	33373	27990	22833	113388	37965	29305	21495	24401	132933	177502	103392
Lợi nhuận thuần từ hoạt động kinh doanh###Net Profit from Operating activities	59116	45811	322300	99848	84555	88808	52089	315631	97826	82398	83907	51721	313791	254246	163660
Thu nhập khác###Other incomes	7	10	144	65	10	46	23	143	21	47	50	25	372	176	3416
Chi phí khác###Other Expenses	7	11	1919	71	1778	47	23	533	26	155	336	17	333	164	565
Lợi nhuận khác###Other profits	0	0	-1774	-6	-1768	-1	0	-391	-5	-108	-286	8	40	12	2851
Tổng lợi nhuận kế toán trước thuế###Total profit before tax	59116	45811	320526	99842	82787	88807	52090	315241	97821	82291	83621	51729	313831	254258	166511
Chi phí thuế TNDN###Corporate Income Tax Expenses	12310	8585	64459	14333	22645	17053	10429	62857	12832	16283	16629	10301	63613	56874	36299
Chi phí thuế TNDN###Corporate Income Tax Expenses	12310	8585	64459	14333	22645	17053	10429	62857	12832	16283	16629	10301	63613	48506	43186
Chi phí thuế TNDN###Corporate Income Tax Expenses	0	0	0	0	0	0	0	0	0	0	0	0	0	8368	-6887
Lợi nhuận sau thuế thu nhập doanh nghiệp###Profit after Corporate Income Tax	46806	37224	256066	85509	60143	71754	41660	252383	84990	66007	66993	41427	250217	197367	130195
---Cac Chi So Tai Chinh---															
EBITDA	0.00	0.00	0.00	0.00	0.00	0.00	0.00	0.00	0.00	0.00	0.00	0.00	0.00	0.00	0.00
Giá giao dịch cuối quý###Last Price of Quarter	118.10	80.60	97.46	97.46	98.24	93.39	101.27	89.72	89.72	0.00	0.00	0.00	0.00	0.00	0.00
