CAN DOI KE TOAN	 2019	 2018	 2017	 2016	Q4 2016	Q2 2016	 2015	Q4 2015	 2014	Q4 2014	 2013	 2012	Q4 2012	 2011	Q4 2011	 2010
Tài sản ngắn hạn###Current Assets	101983	118384	136741	107848	107848	103397	99028	99028	100559	100559	85942	88080	88080	114696	114696	74101
Tiền và các khoản tương đương tiền###Cash and Cash Euivalents	20816	11783	23930	14202	14202	6240	3128	3128	2458	2458	12278	464	464	7535	7535	7638
Các khoản đầu tư tài chính ngắn hạn###Short term financial investment	0	0	0	0	0	0	0	0	0	0	0	0	0	3	3	3
Các khoản phải thu ngắn hạn###Short term Account Receivables	55090	66713	75066	62222	62222	54904	58782	58782	73178	73178	45244	60702	60702	65770	65770	42494
Hàng tồn kho###Inventory	23408	33797	30714	26944	26944	33895	33384	33384	22613	22613	23852	23525	23525	35492	35492	21780
Tài sản ngắn hạn khác###Other Current Assets	2669	6093	7031	4479	4479	8358	3735	3735	2310	2310	4567	3389	3389	5896	5896	2186
Tài sản dài hạn###Non-current Assets	115030	124350	116714	59936	59936	52677	52639	52639	49942	49942	61855	55213	55213	60419	60419	39368
Các khoản phải thu dài hạn###Long term Account Receivable	100	100	0	0	0	0	0	0	0	0	0	0	0	0	0	0
Tài sản cố định ###Fixed assets	110760	106769	110980	54873	54873	43804	50129	50129	47878	47878	59957	53664	53664	56215	56215	36334
Tài sản cố định hữu hình - Giá trị hao mòn lũy kế	-185900	-167368	-147445	-134501	-134501	-131267	-123840	-123840	-110435	-110435	-96266	-83597	-83597	-74748	-74748	-64867
Tài sản cố định thuê tài chính - Giá trị hao mòn lũy kế	0	0	0	0	0	0	0	0	0	0	0	0	0	0	0	0
Tài sản cố định vô hình - Giá trị hao mòn lũy kế	-937	-684	-535	-415	-415	-367	-351	-351	-351	-351	-368	-368	-368	-368	-368	-368
Lợi thế thương mại	0	0	0	0	0	0	0	0	0	0	0	0	0	0	0	0
Bất động sản đầu tư ###Real Estate Investment	0	0	0	0	0	0	0	0	0	0	0	0	0	0	0	0
Các khoản đầu tư tài chính dài hạn###Long term Finacial Investments	0	0	0	0	0	0	0	0	0	0	0	0	0	0	0	0
Tài sản dài hạn khác###Other long term assets	4103	5954	4944	2811	2811	2150	2510	2510	2057	2057	1899	1549	1549	2120	2120	1633
TỔNG CỘNG TÀI SẢN ###TOTAL ASSETS	217013	242735	253455	167784	167784	156074	151667	151667	150501	150501	147797	143293	143293	175115	175115	113469
Nợ phải trả ###Liabilities	87944	117535	129966	56288	56288	55680	51296	51296	58957	58957	60530	61463	61463	104448	104448	45980
Nợ ngắn hạn###Short term Liabilities	76382	102491	97808	43029	43029	55680	50561	50561	58957	58957	51189	53413	53413	94470	94470	43477
Nợ dài hạn###Long term Liabilities	11562	15044	32158	13259	13259	0	735	735	0	0	9342	8050	8050	9978	9978	2503
Dự phòng nghiệp vụ	0	0	0	0	0	0	0	0	0	0	0	0	0	0	0	0
No khac	0	0	0	0	0	0	0	0	0	0	0	0	0	0	0	0
Vốn chủ sở hữu ###Owners equity	129069	125200	123489	111496	111496	100394	100372	100372	91544	91544	87267	81830	81830	70667	70667	67489
Nguồn kinh phí và quỹ khác###Expenditures and Other Funds	0	0	0	0	0	0	0	0	0	0	0	0	0	0	0	0
Vốn chủ sở hữu ###Owners equity	129069	125200	123489	111496	111496	100394	100372	100372	91544	91544	87267	81830	81830	70667	70667	67489
Lợi ích của cổ đông thiểu số	0	0	0	0	0	0	0	0	0	0	0	0	0	0	0	0
TỔNG CỘNG NGUỒN VỐN ###TOTAL EQUITY	0	0	0	0	0	0	0	0	0	0	0	0	0	0	0	0



KET QUA KINH DOANH	 2019	 2018	 2017	 2016	 2015	 2014	 2013	 2012	 2011	 2010
Tổng doanh thu hoạt động kinh doanh###Gross Sale Revenues	369504	418965	410860	365243	345133	346066	331304	365473	355816	244417
Các khoản giảm trừ doanh thu###Deduction revenues	641	0	0	0	0	0	0	0	17	0
Doanh thu thuần###Net Sales	368863	418965	410860	365243	345133	346066	331304	365473	355799	244417
Giá vốn hàng bán###Cost of goods sold	311713	361691	344816	303994	293509	300123	285825	316531	321500	219403
Lợi nhuận gộp###Gross profit	57151	57273	66045	61249	51623	45943	45479	48942	34299	25014
Doanh thu hoạt động tài chính###Financial activities Revenues	720	695	793	1151	1159	971	920	730	631	197
Chi phí tài chính###Financial Expenses	3907	4836	2445	1897	2482	2145	2869	5216	6537	4671
Chi phí bán hàng###Selling Expenses	18383	22480	20047	17087	13122	10687	9432	9917	6949	4935
Chi phí quản lý doanh nghiệp###Managing Expenses	18645	15842	16169	20028	16727	16476	14902	10180	9169	7112
Lợi nhuận thuần từ hoạt động kinh doanh###Net Profit from Operating activities	16936	14811	28177	23387	20452	17606	19196	24358	12274	8492
Thu nhập khác###Other incomes	427	286	1722	3302	4108	1127	2491	1255	949	806
Chi phí khác###Other Expenses	17	91	2101	209	104	17	300	869	108	11
Lợi nhuận khác###Other profits	410	196	-380	3093	4004	1111	2192	386	841	796
Tổng lợi nhuận kế toán trước thuế###Total profit before tax	17346	15006	27797	26480	24456	18716	21388	24743	13115	9288
Chi phí thuế TNDN###Corporate Income Tax Expenses	3479	3021	5638	5294	5398	4100	5347	4406	3313	2325
Chi phí thuế TNDN###Corporate Income Tax Expenses	3479	3021	5638	5294	5398	4100	5347	4406	3313	2325
Chi phí thuế TNDN###Corporate Income Tax Expenses	0	0	0	0	0	0	0	0	0	0
Lợi nhuận sau thuế thu nhập doanh nghiệp###Profit after Corporate Income Tax	13867	11985	22159	21186	19059	14616	16041	20338	9802	6963
---Cac Chi So Tai Chinh---										
EBITDA	0.00	0.00	0.00	0.00	0.00	0.00	0.00	0.00	0.00	0.00
Giá giao dịch cuối quý###Last Price of Quarter	19.50	22.49	22.20	17.32	0.00	0.00	0.00	0.00	0.00	0.00
