CAN DOI KE TOAN	Q2 2020	Q1 2020	 2019	Q4 2019	Q3 2019	Q2 2019	Q1 2019	 2018	Q4 2018	Q3 2018	Q2 2018	Q1 2018	 2017	Q4 2017	 2016	 2015
Tài sản ngắn hạn###Current Assets	137534	192417	172301	172272	177519	185235	169426	148863	148416	157034	155086	131594	124029	124029	96755	31059
Tiền và các khoản tương đương tiền###Cash and Cash Euivalents	4783	28903	6602	6602	5510	4456	20293	11281	26281	2329	5717	5089	27915	27915	21649	148
Các khoản đầu tư tài chính ngắn hạn###Short term financial investment	0	14300	24000	24000	24000	34000	10000	15000	0	0	0	0	0	0	0	0
Các khoản phải thu ngắn hạn###Short term Account Receivables	100343	109129	128469	128440	108242	91351	89889	96787	96315	66716	81669	72284	59806	59806	38418	2103
Hàng tồn kho###Inventory	31780	34474	12621	12621	39278	55021	48909	25584	25608	87383	67505	54124	35960	35960	36418	27381
Tài sản ngắn hạn khác###Other Current Assets	628	5611	609	609	489	407	335	212	212	607	195	97	348	348	270	1427
Tài sản dài hạn###Non-current Assets	113052	53413	73773	73745	54106	54480	54828	55144	55146	44104	44941	45789	45922	45922	47602	2665
Các khoản phải thu dài hạn###Long term Account Receivable	0	0	0	0	0	0	0	0	0	0	0	0	0	0	0	0
Tài sản cố định ###Fixed assets	10721	11029	11336	11336	11644	11952	12259	12516	12522	25973	26714	27454	26798	26798	29574	2665
Tài sản cố định hữu hình - Giá trị hao mòn lũy kế	-5480	-5172	-4864	-4864	-4557	-4249	-3941	-3634	-3628	-6813	-6072	-5332	-4611	-4611	-1835	-197
Tài sản cố định thuê tài chính - Giá trị hao mòn lũy kế	0	0	0	0	0	0	0	0	0	0	0	0	0	0	0	0
Tài sản cố định vô hình - Giá trị hao mòn lũy kế	0	0	0	0	0	0	0	0	0	0	0	0	0	0	0	0
Lợi thế thương mại	0	0	0	0	0	0	0	0	0	0	0	0	0	0	0	0
Bất động sản đầu tư ###Real Estate Investment	0	0	0	0	0	0	0	0	0	0	0	0	0	0	0	0
Các khoản đầu tư tài chính dài hạn###Long term Finacial Investments	84028	39028	59028	59000	39000	39013	39000	39007	39000	14000	14000	14000	14000	14000	14000	0
Tài sản dài hạn khác###Other long term assets	3303	3356	3409	3409	3462	3515	3568	3621	3624	4131	4228	4336	4115	4115	4028	0
TỔNG CỘNG TÀI SẢN ###TOTAL ASSETS	250586	245829	246075	246018	231626	239716	224253	204007	203561	201139	200027	177383	169951	169951	144358	33724
Nợ phải trả ###Liabilities	12735	7796	11226	11220	16114	36955	27360	12759	12745	13269	23052	1480	2013	2013	98	20991
Nợ ngắn hạn###Short term Liabilities	12735	7796	11226	11220	16114	36955	27360	12759	12745	13269	23052	1480	2013	2013	98	20991
Nợ dài hạn###Long term Liabilities	0	0	0	0	0	0	0	0	0	0	0	0	0	0	0	0
Dự phòng nghiệp vụ	0	0	0	0	0	0	0	0	0	0	0	0	0	0	0	0
No khac	0	0	0	0	0	0	0	0	0	0	0	0	0	0	0	0
Vốn chủ sở hữu ###Owners equity	237851	238033	234848	234797	215512	202761	196893	191248	190817	187870	176976	175903	167939	167939	144259	12733
Nguồn kinh phí và quỹ khác###Expenditures and Other Funds	0	0	0	0	0	0	0	0	0	0	0	0	0	0	0	0
Vốn chủ sở hữu ###Owners equity	237851	238033	234848	234797	215512	202761	196893	191248	190817	187870	176976	175903	167939	167939	144259	12733
Lợi ích của cổ đông thiểu số	0	0	0	0	0	0	0	0	0	0	0	0	0	0	0	0
TỔNG CỘNG NGUỒN VỐN ###TOTAL EQUITY	0	0	0	0	0	0	0	0	0	0	0	0	0	0	0	0



KET QUA KINH DOANH	Q2 2020	Q1 2020	 2019	Q4 2019	Q3 2019	Q2 2019	Q1 2019	 2018	Q4 2018	Q3 2018	Q2 2018	Q1 2018	 2017	Q4 2017	Q3 2017	 2016	 2015
Tổng doanh thu hoạt động kinh doanh###Gross Sale Revenues	51668	47869	464526	142063	128514	103783	90166	313155	136253	76513	45311	55078	221883	48646	65094	167112	48227
Các khoản giảm trừ doanh thu###Deduction revenues	0	0	0	0	0	0	0	0	0	0	0	0	0	0	0	0	0
Doanh thu thuần###Net Sales	51668	47869	464526	142063	128514	103783	90166	313155	136253	76513	45311	55078	221883	48646	65094	167112	48227
Giá vốn hàng bán###Cost of goods sold	49915	45480	413548	121541	115073	97203	79796	276959	122510	66195	41423	46779	197160	46382	54457	148573	46258
Lợi nhuận gộp###Gross profit	1752	2389	50978	20522	13441	6580	10370	36197	13744	10319	3888	8299	24723	2264	10637	18539	1969
Doanh thu hoạt động tài chính###Financial activities Revenues	425	424	1576	426	437	378	305	201	129	0	1	71	277	96	68	4	2
Chi phí tài chính###Financial Expenses	0	0	0	0	0	0	0	0	0	0	0	0	1	1	0	222	320
Chi phí bán hàng###Selling Expenses	0	0	3471	1067	756	597	1052	793	712	0	0	81	423	423	0	350	690
Chi phí quản lý doanh nghiệp###Managing Expenses	339	523	1490	359	358	375	332	1192	289	233	342	319	897	385	197	442	228
Lợi nhuận thuần từ hoạt động kinh doanh###Net Profit from Operating activities	1838	2290	47613	19522	12764	5992	9291	34420	12872	10086	3547	7970	23680	1552	10508	17529	733
Thu nhập khác###Other incomes	0	0	0	0	0	0	0	1015	185	817	0	0	0	0	0	0	0
Chi phí khác###Other Expenses	0	0	1	0	0	1	0	212	167	3	36	6	0	0	0	3	0
Lợi nhuận khác###Other profits	0	0	-1	0	0	-1	0	802	17	814	-36	-6	0	0	0	-3	0
Tổng lợi nhuận kế toán trước thuế###Total profit before tax	1837	2290	47612	19522	12764	5992	9291	35223	12890	10900	3510	7964	23679	1551	10508	17526	733
Chi phí thuế TNDN###Corporate Income Tax Expenses	135	105	500	237	0	131	126	95	26	0	70	0	0	0	0	0	0
Chi phí thuế TNDN###Corporate Income Tax Expenses	135	105	500	237	0	131	126	95	26	0	70	0	0	0	0	0	0
Chi phí thuế TNDN###Corporate Income Tax Expenses	0	0	0	0	0	0	0	0	0	0	0	0	0	0	0	0	0
Lợi nhuận sau thuế thu nhập doanh nghiệp###Profit after Corporate Income Tax	1760	2196	47113	19285	12764	5861	9164	35127	12864	10900	3441	7964	23679	1551	10508	17526	733
---Cac Chi So Tai Chinh---																	
EBITDA	1.11	0.71	0.15	0.15	-1.12	-0.83	-0.56	-0.68	-0.68	0.07	-0.09	0.00	0.00	0.00	0.00	0.00	0.00
Giá giao dịch cuối quý###Last Price of Quarter	4.83	3.38	7.46	7.46	8.00	7.97	9.89	12.10	12.10	16.42	15.82	0.00	0.00	0.00	0.00	0.00	0.00
