CAN DOI KE TOAN	Q2 2020	Q1 2020	 2019	Q4 2019	Q3 2019	Q2 2019	Q1 2019	 2018	Q4 2018	Q3 2018	Q2 2018	Q1 2018	 2017	Q4 2017	 2016	 2015	 2014
Tài sản ngắn hạn###Current Assets	439351	445460	427538	427546	440856	444475	413470	434188	434200	380374	377578	391985	400615	400615	480874	415375	393751
Tiền và các khoản tương đương tiền###Cash and Cash Euivalents	34179	32527	40678	40678	58552	71538	94219	85039	107039	84790	73316	139448	126869	126869	200739	179466	143998
Các khoản đầu tư tài chính ngắn hạn###Short term financial investment	127790	105511	97031	97031	104200	107650	98095	92995	70995	88167	91167	55060	48060	48060	33500	41150	0
Các khoản phải thu ngắn hạn###Short term Account Receivables	116980	152224	145716	145716	95796	106551	94259	131064	131076	77975	87587	82353	114748	114748	129427	94523	157218
Hàng tồn kho###Inventory	148222	142094	131117	131125	167395	144931	114290	113646	113646	117989	113691	103730	99315	99315	105522	88744	82793
Tài sản ngắn hạn khác###Other Current Assets	12181	13102	12996	12996	14913	13804	12607	11444	11444	11453	11816	11394	11624	11624	11685	11491	9741
Tài sản dài hạn###Non-current Assets	303427	300708	304237	301487	286774	273750	270701	272916	267003	254648	254821	251973	256353	256353	243137	234665	267980
Các khoản phải thu dài hạn###Long term Account Receivable	2694	2778	2964	2964	2997	2983	1986	1944	1930	1930	1930	1930	2256	2256	2642	295	0
Tài sản cố định ###Fixed assets	94179	76805	80232	80232	79704	81952	82412	83785	83044	78245	81885	80005	83701	83701	106385	108641	120019
Tài sản cố định hữu hình - Giá trị hao mòn lũy kế	-175677	-171790	-167862	-167862	-165379	-161323	-158142	-154162	-154162	-150329	-146766	-143346	-140818	-140818	-135838	-125417	-112097
Tài sản cố định thuê tài chính - Giá trị hao mòn lũy kế	0	0	0	0	0	0	0	0	0	0	0	0	0	0	0	0	0
Tài sản cố định vô hình - Giá trị hao mòn lũy kế	-2693	-2628	-2564	-2564	-2500	-2435	-2371	-2272	-1977	-1846	-1716	-1586	-1456	-1456	-958	-804	-607
Lợi thế thương mại	0	0	0	0	0	0	0	0	0	0	0	0	0	0	0	0	0
Bất động sản đầu tư ###Real Estate Investment	43100	44107	45113	45113	46120	47126	48133	49139	49139	50107	51122	52139	53200	53200	42442	45500	48559
Các khoản đầu tư tài chính dài hạn###Long term Finacial Investments	130763	125257	125590	122838	111727	109552	103861	105466	99590	89438	87468	83786	84262	84262	69579	61838	57402
Tài sản dài hạn khác###Other long term assets	26802	27349	27107	27088	26891	26241	26773	26401	27120	27277	27890	29117	28729	28729	22044	14654	41950
TỔNG CỘNG TÀI SẢN ###TOTAL ASSETS	742778	746168	731775	729032	727630	718225	684171	707104	701204	635022	632399	643958	656967	656967	724011	650040	661731
Nợ phải trả ###Liabilities	323395	320914	315493	315254	332338	338244	300312	332601	332516	281284	292915	302660	324390	324390	426671	382706	442827
Nợ ngắn hạn###Short term Liabilities	241077	237440	231579	230747	248282	252754	213042	242978	243283	190412	200951	208242	228236	228236	256971	230264	289662
Nợ dài hạn###Long term Liabilities	82319	83474	83914	84507	84056	85490	87270	89623	89233	90872	91964	94417	96155	96155	169700	152443	153165
Dự phòng nghiệp vụ	0	0	0	0	0	0	0	0	0	0	0	0	0	0	0	0	0
No khac	0	0	0	0	0	0	0	0	0	0	0	0	0	0	0	0	0
Vốn chủ sở hữu ###Owners equity	419383	425253	416282	413778	395292	379981	383859	374503	368687	353737	339484	341299	332577	332577	297340	267333	218903
Nguồn kinh phí và quỹ khác###Expenditures and Other Funds	0	0	0	0	0	0	0	0	0	0	0	0	0	0	0	0	0
Vốn chủ sở hữu ###Owners equity	419383	425253	416282	413778	395292	379981	383859	374503	368687	353737	339484	341299	332577	332577	297340	267333	218903
Lợi ích của cổ đông thiểu số	0	0	0	0	0	0	0	0	0	0	0	0	0	0	0	0	0
TỔNG CỘNG NGUỒN VỐN ###TOTAL EQUITY	0	0	0	0	0	0	0	0	0	0	0	0	0	0	0	0	0



KET QUA KINH DOANH	Q2 2020	Q1 2020	 2019	Q4 2019	Q3 2019	Q2 2019	Q1 2019	 2018	Q4 2018	Q3 2018	Q2 2018	Q1 2018	 2017	 2016	 2015
Tổng doanh thu hoạt động kinh doanh###Gross Sale Revenues	118976	81869	472816	175287	104156	101844	91602	454367	166205	113741	106658	67763	437141	403668	402795
Các khoản giảm trừ doanh thu###Deduction revenues	228	37	2641	2569	72	0	0	1357	32	0	1087	238	1497	862	799
Doanh thu thuần###Net Sales	118748	81832	470175	172718	104084	101844	91602	453010	166173	113741	105572	67525	435644	402806	401996
Giá vốn hàng bán###Cost of goods sold	92827	57094	376655	146364	81883	77729	70740	358699	145283	86891	80530	45945	341240	327860	326135
Lợi nhuận gộp###Gross profit	25921	24738	93521	26354	22201	24116	20862	94311	20891	26849	25041	21579	94404	74946	75861
Doanh thu hoạt động tài chính###Financial activities Revenues	2964	1125	9788	2040	2700	4054	994	9153	3145	1428	3254	1334	8169	5996	3878
Chi phí tài chính###Financial Expenses	804	468	2318	511	591	548	668	2184	700	524	486	482	2772	2982	2860
Chi phí bán hàng###Selling Expenses	2025	2376	9316	3350	1741	1849	2376	9431	3173	1922	2111	2225	8852	7708	5911
Chi phí quản lý doanh nghiệp###Managing Expenses	6972	8931	46397	19598	9471	10740	6289	35928	15011	10318	5339	5357	42746	39329	27758
Lợi nhuận thuần từ hoạt động kinh doanh###Net Profit from Operating activities	26565	14620	78422	18668	17895	25014	14404	81314	15304	17483	27653	14950	68064	46727	52630
Thu nhập khác###Other incomes	566	431	6207	1978	1258	1398	1572	3910	2465	740	562	348	8784	9531	11917
Chi phí khác###Other Expenses	635	367	3164	781	1132	836	415	2446	704	1192	370	261	1734	2864	1980
Lợi nhuận khác###Other profits	-70	65	3043	1197	127	562	1157	1463	1761	-453	192	87	7050	6667	9937
Tổng lợi nhuận kế toán trước thuế###Total profit before tax	26495	14685	81465	19865	18022	25576	15561	82777	17065	17031	27844	15036	75114	53394	62567
Chi phí thuế TNDN###Corporate Income Tax Expenses	3834	2841	9817	1375	2711	3145	2649	11152	2115	2777	3437	2838	10666	5772	8389
Chi phí thuế TNDN###Corporate Income Tax Expenses	3879	2885	10030	1657	2713	3071	2651	11209	2570	2645	3229	2759	11016	6482	8826
Chi phí thuế TNDN###Corporate Income Tax Expenses	-45	-44	-213	-282	-2	74	-2	-57	-454	132	209	79	-350	-710	-438
Lợi nhuận sau thuế thu nhập doanh nghiệp###Profit after Corporate Income Tax	24294	13022	76559	19029	16254	24492	14283	77175	14622	16079	24407	13168	68193	48844	57591
---Cac Chi So Tai Chinh---															
EBITDA	0.01	0.29	-0.08	-0.08	-0.20	-0.07	0.56	0.00	0.00	0.00	0.00	0.00	0.00	0.00	0.00
Giá giao dịch cuối quý###Last Price of Quarter	18.30	16.60	20.50	20.50	20.50	17.80	17.21	0.00	0.00	0.00	0.00	0.00	0.00	0.00	0.00
