CAN DOI KE TOAN	 2019	 2018	 2017	 2016	Q4 2016	 2015	Q4 2015	 2014	Q4 2014	 2013	Q4 2013	 2012	Q4 2012	Q2 2012	 2011	Q4 2011	 2010	Q4 2010	 2009
Tài sản ngắn hạn###Current Assets	395008	423036	593932	453159	453159	410758	410758	333978	333978	374724	374724	363257	363719	326054	363066	363066	294077	294077	267599
Tiền và các khoản tương đương tiền###Cash and Cash Euivalents	7373	20694	35707	8738	8738	13271	13271	28561	28561	16990	16990	24668	24668	9266	4817	4817	5640	5640	2525
Các khoản đầu tư tài chính ngắn hạn###Short term financial investment	26647	10545	10000	0	0	0	0	0	0	0	0	0	0	0	0	0	0	0	0
Các khoản phải thu ngắn hạn###Short term Account Receivables	227855	242181	390355	188113	188113	149075	149075	139244	139244	213758	213758	204545	205007	169650	213206	213206	158757	158757	155596
Hàng tồn kho###Inventory	126551	144997	154473	247451	247451	242061	242061	161336	161336	141289	141289	133811	133811	146204	144047	144047	128746	128746	108828
Tài sản ngắn hạn khác###Other Current Assets	6582	4620	3397	8857	8857	6351	6351	4837	4837	2686	2686	233	233	934	996	996	934	934	650
Tài sản dài hạn###Non-current Assets	34072	43577	38544	39226	39226	42354	42354	48147	48147	53010	53010	46553	46553	46228	34421	34421	35491	35491	40242
Các khoản phải thu dài hạn###Long term Account Receivable	0	0	0	0	0	0	0	0	0	0	0	0	0	0	0	0	0	0	0
Tài sản cố định ###Fixed assets	33882	19577	30110	30866	30866	33981	33981	38722	38722	42615	42615	10440	10417	9957	28260	28260	29491	29491	34242
Tài sản cố định hữu hình - Giá trị hao mòn lũy kế	-48088	-21697	-64272	-59065	-59065	-55022	-55022	-50923	-50923	-46452	-46452	-7340	-7829	-6935	-38184	-38184	-32574	-32574	-26320
Tài sản cố định thuê tài chính - Giá trị hao mòn lũy kế	0	0	0	0	0	0	0	0	0	0	0	0	0	0	0	0	0	0	0
Tài sản cố định vô hình - Giá trị hao mòn lũy kế	0	-517	-8017	-7642	-7642	-6142	-6142	-4592	-4592	-3042	-3042	-245	245	-153	-122	-122	0	0	0
Lợi thế thương mại	0	0	0	0	0	0	0	0	0	0	0	0	0	0	0	0	0	0	0
Bất động sản đầu tư ###Real Estate Investment	0	0	0	0	0	0	0	0	0	0	0	0	0	0	0	0	0	0	0
Các khoản đầu tư tài chính dài hạn###Long term Finacial Investments	0	24000	6000	6000	6000	6000	6000	6000	6000	6000	6000	36000	36000	36000	6000	6000	6000	6000	6000
Tài sản dài hạn khác###Other long term assets	190	0	2433	2360	2360	2373	2373	3425	3425	4395	4395	114	114	271	160	160	0	0	0
TỔNG CỘNG TÀI SẢN ###TOTAL ASSETS	429080	466614	632476	492385	492385	453111	453111	382125	382125	427734	427734	409810	410273	372282	397486	397486	329568	329568	307841
Nợ phải trả ###Liabilities	347436	409963	561874	424688	424688	386577	386577	319128	319128	366648	366648	364623	365086	336330	358127	358127	291492	291492	274924
Nợ ngắn hạn###Short term Liabilities	341436	401755	551621	414165	414165	372419	372419	303930	303930	349410	349410	363641	364103	334231	355021	355021	283577	283577	260254
Nợ dài hạn###Long term Liabilities	6000	8208	10253	10523	10523	14158	14158	15198	15198	17238	17238	983	983	2099	3106	3106	7916	7916	14670
Dự phòng nghiệp vụ	0	0	0	0	0	0	0	0	0	0	0	0	0	0	0	0	0	0	0
No khac	0	0	0	0	0	0	0	0	0	0	0	0	0	0	0	0	0	0	0
Vốn chủ sở hữu ###Owners equity	81644	56651	70601	67697	67697	66535	66535	42602	62996	40924	61086	45186	45186	35953	39359	39359	38075	38075	32917
Nguồn kinh phí và quỹ khác###Expenditures and Other Funds	0	0	0	0	0	0	0	0	0	0	0	0	0	0	0	0	0	0	0
Vốn chủ sở hữu ###Owners equity	81644	56651	70601	67697	67697	66535	66535	42602	62996	40924	61086	45186	45186	35953	39359	39359	38075	38075	32917
Lợi ích của cổ đông thiểu số	0	0	0	0	0	0	0	0	20395	20162	20162	0	0	0	0	0	0	0	0
TỔNG CỘNG NGUỒN VỐN ###TOTAL EQUITY	0	0	0	0	0	0	0	0	0	0	0	0	0	0	0	0	0	0	0



KET QUA KINH DOANH	 2019	 2018	 2017	 2016	 2015	 2014	 2013	 2012	Q2 2012	Q1 2012	 2011	 2010	 2009
Tổng doanh thu hoạt động kinh doanh###Gross Sale Revenues	1133424	990583	1147898	855524	725279	661682	556159	657101	162541	104692	566757	465831	381679
Các khoản giảm trừ doanh thu###Deduction revenues	4164	2765	5673	10820	4216	7252	10719	12603	2181	930	7154	6181	7245
Doanh thu thuần###Net Sales	1129260	987818	1142225	844704	721063	654430	545441	644498	160360	103762	559603	459650	374433
Giá vốn hàng bán###Cost of goods sold	1061631	932345	1081201	784867	650349	568029	453621	561564	139968	83338	478032	385232	316074
Lợi nhuận gộp###Gross profit	67629	55473	61024	59837	70715	86401	91819	82934	20392	20424	81571	74418	58359
Doanh thu hoạt động tài chính###Financial activities Revenues	2012	16682	235	95	249	685	822	1250	312	244	4827	4491	2317
Chi phí tài chính###Financial Expenses	22501	36116	21884	20196	19542	25222	31277	39353	10700	10076	42908	27441	19194
Chi phí bán hàng###Selling Expenses	25120	18173	18624	13051	17728	20901	20237	31613	5123	5920	22457	32501	26782
Chi phí quản lý doanh nghiệp###Managing Expenses	12354	7679	10453	18633	20359	26253	28936	12929	4416	3264	13746	12130	9082
Lợi nhuận thuần từ hoạt động kinh doanh###Net Profit from Operating activities	9665	10186	10297	8052	13336	14710	12191	289	465	1408	7286	6837	5617
Thu nhập khác###Other incomes	136	10	110	256	181	2236	5	14012	0	7	1846	50	0
Chi phí khác###Other Expenses	147	115	132	148	72	2602	0	0	0	0	0	0	0
Lợi nhuận khác###Other profits	-11	-105	-23	108	109	-365	5	14012	0	7	1846	50	0
Tổng lợi nhuận kế toán trước thuế###Total profit before tax	9654	10081	10274	8159	13445	14344	12195	14301	465	1414	9132	6887	5617
Chi phí thuế TNDN###Corporate Income Tax Expenses	1985	1762	2107	1854	3071	3860	3030	3564	93	123	1455	1380	1075
Chi phí thuế TNDN###Corporate Income Tax Expenses	1985	1762	2060	1685	2232	2639	3575	3517	93	283	1615	1380	1075
Chi phí thuế TNDN###Corporate Income Tax Expenses	0	0	47	168	839	1221	-545	46	0	-160	-160	0	0
Lợi nhuận sau thuế thu nhập doanh nghiệp###Profit after Corporate Income Tax	7669	8319	9208	6305	12512	12795	10927	10737	372	1292	7678	5507	4542
---Cac Chi So Tai Chinh---													
EBITDA	0.00	0.00	0.00	0.00	0.00	0.00	0.00	0.00	0.00	0.00	0.00	0.00	0.00
Giá giao dịch cuối quý###Last Price of Quarter	11.50	8.97	9.93	12.10	7.28	8.04	10.20	7.88	5.87	9.59	10.13	9.52	0.00
