CAN DOI KE TOAN	Q2 2020	Q1 2020	 2019	Q4 2019	Q3 2019	Q2 2019	Q1 2019	 2018	 2017
Tài sản ngắn hạn###Current Assets	23870	19589	28349	28349	9613	25530	27675	13092	25378
Tiền và các khoản tương đương tiền###Cash and Cash Euivalents	1230	4208	12809	12809	2537	980	14909	1194	6642
Các khoản đầu tư tài chính ngắn hạn###Short term financial investment	0	0	0	0	6000	0	0	0	0
Các khoản phải thu ngắn hạn###Short term Account Receivables	22452	15161	15281	15281	776	24228	12484	11456	18149
Hàng tồn kho###Inventory	152	152	152	152	152	152	162	162	285
Tài sản ngắn hạn khác###Other Current Assets	37	68	107	107	148	170	121	281	302
Tài sản dài hạn###Non-current Assets	246344	251466	256687	256687	261916	267223	272504	277638	292742
Các khoản phải thu dài hạn###Long term Account Receivable	0	0	0	0	0	0	0	0	0
Tài sản cố định ###Fixed assets	246022	251225	256428	256428	261631	266848	272076	277257	287894
Tài sản cố định hữu hình - Giá trị hao mòn lũy kế	-140880	-135677	-130474	-130474	-125271	-120054	-114826	-109599	-89068
Tài sản cố định thuê tài chính - Giá trị hao mòn lũy kế	0	0	0	0	0	0	0	0	0
Tài sản cố định vô hình - Giá trị hao mòn lũy kế	0	0	0	0	0	0	0	0	0
Lợi thế thương mại	0	0	0	0	0	0	0	0	0
Bất động sản đầu tư ###Real Estate Investment	0	0	0	0	0	0	0	0	0
Các khoản đầu tư tài chính dài hạn###Long term Finacial Investments	0	0	0	0	0	0	0	0	0
Tài sản dài hạn khác###Other long term assets	259	233	259	259	285	375	429	381	356
TỔNG CỘNG TÀI SẢN ###TOTAL ASSETS	270214	271055	285036	285036	271529	292753	300180	290730	318119
Nợ phải trả ###Liabilities	118463	126871	135721	135721	131415	146836	145297	154886	192193
Nợ ngắn hạn###Short term Liabilities	33663	36015	38809	38809	28447	37812	30217	33750	46833
Nợ dài hạn###Long term Liabilities	84800	90856	96912	96912	102968	109024	115080	121136	145360
Dự phòng nghiệp vụ	0	0	0	0	0	0	0	0	0
No khac	0	0	0	0	0	0	0	0	0
Vốn chủ sở hữu ###Owners equity	151751	144184	149315	149315	140114	145917	154883	135844	125927
Nguồn kinh phí và quỹ khác###Expenditures and Other Funds	0	0	0	0	0	0	0	0	0
Vốn chủ sở hữu ###Owners equity	151751	144184	149315	149315	140114	145917	154883	135844	125927
Lợi ích của cổ đông thiểu số	0	0	0	0	0	0	0	0	0
TỔNG CỘNG NGUỒN VỐN ###TOTAL EQUITY	0	0	0	0	0	0	0	0	0



KET QUA KINH DOANH	Q2 2020	Q1 2020	 2019	Q4 2019	Q3 2019	Q2 2019	Q1 2019	 2018	Q1 2018	 2017
Tổng doanh thu hoạt động kinh doanh###Gross Sale Revenues	22334	21656	103466	29830	6564	30339	36734	88915	34874	117365
Các khoản giảm trừ doanh thu###Deduction revenues	0	0	0	0	0	0	0	0	0	0
Doanh thu thuần###Net Sales	22334	21656	103466	29830	6564	30339	36734	88915	34874	117365
Giá vốn hàng bán###Cost of goods sold	10489	9327	46484	13998	8084	11893	12509	43080	11775	41569
Lợi nhuận gộp###Gross profit	11845	12329	56982	15832	-1520	18445	24224	45836	23099	75796
Doanh thu hoạt động tài chính###Financial activities Revenues	1	85	251	63	66	120	2	6	2	21
Chi phí tài chính###Financial Expenses	2968	3138	13202	3328	3481	3137	3255	14545	3860	17433
Chi phí bán hàng###Selling Expenses	0	0	0	0	0	0	0	0	0	0
Chi phí quản lý doanh nghiệp###Managing Expenses	907	1019	4125	1370	850	982	922	5856	1621	5429
Lợi nhuận thuần từ hoạt động kinh doanh###Net Profit from Operating activities	7971	8257	39906	11197	-5786	14446	20049	25441	17620	52956
Thu nhập khác###Other incomes	0	3	0	0	0	0	0	1	0	0
Chi phí khác###Other Expenses	0	5	27	9	17	0	0	152	5	204
Lợi nhuận khác###Other profits	0	-2	-27	-9	-17	0	0	-152	-5	-204
Tổng lợi nhuận kế toán trước thuế###Total profit before tax	7971	8255	39880	11188	-5803	14446	20049	25289	17615	52752
Chi phí thuế TNDN###Corporate Income Tax Expenses	404	423	2025	286	0	728	1010	0	0	0
Chi phí thuế TNDN###Corporate Income Tax Expenses	404	423	2025	286	0	728	1010	0	0	0
Chi phí thuế TNDN###Corporate Income Tax Expenses	0	0	0	0	0	0	0	0	0	0
Lợi nhuận sau thuế thu nhập doanh nghiệp###Profit after Corporate Income Tax	7567	7832	37855	10901	-5803	13718	19038	25289	17615	52752
---Cac Chi So Tai Chinh---										
EBITDA	-0.12	-0.17	-0.53	-0.53	-1.72	0.00	0.00	0.00	0.00	0.00
Giá giao dịch cuối quý###Last Price of Quarter	27.92	29.89	28.37	28.37	28.37	34.89	0.00	0.00	0.00	0.00
