CAN DOI KE TOAN	 2019	 2018	 2017	 2016	 2015	Q4 2015	 2014	Q4 2014	Q2 2014	 2013	Q4 2013	 2012	Q4 2012	 2011
Tài sản ngắn hạn###Current Assets	174903	190258	195564	165810	135141	135141	78924	78924	72961	88922	88922	113116	113116	112180
Tiền và các khoản tương đương tiền###Cash and Cash Euivalents	13693	19114	14320	30230	38843	38843	23738	23738	15420	29902	29902	39217	39217	57589
Các khoản đầu tư tài chính ngắn hạn###Short term financial investment	0	0	0	0	0	0	0	0	0	0	0	0	0	0
Các khoản phải thu ngắn hạn###Short term Account Receivables	77124	60580	61193	66049	58445	58445	34610	34610	35626	42774	42774	40578	40578	23658
Hàng tồn kho###Inventory	83413	110123	115453	64735	35360	35360	19998	19998	20190	15679	15679	30727	30727	26398
Tài sản ngắn hạn khác###Other Current Assets	674	441	4598	4797	2493	2493	579	579	1725	568	568	2594	2594	4535
Tài sản dài hạn###Non-current Assets	79704	92489	93191	113866	114288	114288	199805	199805	202019	203201	203201	188101	188101	188875
Các khoản phải thu dài hạn###Long term Account Receivable	0	9535	9535	28699	28708	28708	0	0	0	0	0	0	0	0
Tài sản cố định ###Fixed assets	10979	11547	11084	11931	12844	12844	105659	40275	39707	105750	40711	48431	31501	37465
Tài sản cố định hữu hình - Giá trị hao mòn lũy kế	-6432	-6085	-7814	-7239	-7489	-7489	-7911	-7911	-7120	-6012	-6012	-5480	-5480	-3963
Tài sản cố định thuê tài chính - Giá trị hao mòn lũy kế	0	0	0	0	0	0	0	0	0	0	0	0	0	0
Tài sản cố định vô hình - Giá trị hao mòn lũy kế	-2399	-2263	-2024	-1752	-1445	-1445	-2602	-2602	-2362	-2456	-2456	-1797	-1797	-1130
Lợi thế thương mại	0	0	0	0	0	0	0	0	0	0	0	0	0	0
Bất động sản đầu tư ###Real Estate Investment	34198	36757	37528	38298	39068	39068	9771	9771	9896	10022	10022	10201	10201	5342
Các khoản đầu tư tài chính dài hạn###Long term Finacial Investments	50	50	50	50	50	50	84222	84222	87089	87089	87089	129462	129462	128991
Tài sản dài hạn khác###Other long term assets	527	948	1354	1259	0	0	153	153	245	340	340	7	7	166
TỔNG CỘNG TÀI SẢN ###TOTAL ASSETS	254607	282747	288755	279676	249429	249429	278729	278729	274980	292123	292123	301217	301217	301055
Nợ phải trả ###Liabilities	112186	141862	149596	151268	112395	112395	149134	149134	142633	157989	157989	198459	198459	210374
Nợ ngắn hạn###Short term Liabilities	53734	83304	91690	96058	56868	56868	93644	93644	87279	102634	102634	112519	112519	119572
Nợ dài hạn###Long term Liabilities	58452	58559	57906	55210	55527	55527	55490	55490	55354	55354	55354	85940	85940	90802
Dự phòng nghiệp vụ	0	0	0	0	0	0	0	0	0	0	0	0	0	0
No khac	0	0	0	0	0	0	0	0	0	0	0	0	0	0
Vốn chủ sở hữu ###Owners equity	142421	140885	139159	128408	137034	137034	129595	129595	132347	134134	134134	102758	102758	90682
Nguồn kinh phí và quỹ khác###Expenditures and Other Funds	16637	16637	16637	16637	16663	16663	0	0	0	0	0	0	0	0
Vốn chủ sở hữu ###Owners equity	125784	124248	122522	111771	120370	120370	129595	129595	132347	134134	134134	102758	102758	90682
Lợi ích của cổ đông thiểu số	0	0	0	0	0	0	0	0	0	0	0	0	0	0
TỔNG CỘNG NGUỒN VỐN ###TOTAL EQUITY	0	0	0	0	0	0	0	0	0	0	0	0	0	0



KET QUA KINH DOANH	 2019	 2018	 2017	 2016	 2015	 2014	 2013	 2012	 2011
Tổng doanh thu hoạt động kinh doanh###Gross Sale Revenues	51117	58036	18152	13813	96196	30831	143749	105587	149323
Các khoản giảm trừ doanh thu###Deduction revenues	0	0	0	0	0	0	0	0	0
Doanh thu thuần###Net Sales	51117	58036	18152	13813	96196	30831	143749	105587	149323
Giá vốn hàng bán###Cost of goods sold	33666	30124	9537	6355	78813	15723	98521	78563	110561
Lợi nhuận gộp###Gross profit	17452	27911	8614	7458	17383	15108	45227	27024	38763
Doanh thu hoạt động tài chính###Financial activities Revenues	52	10	972	2094	201	555	1705	4930	11716
Chi phí tài chính###Financial Expenses	965	2041	666	16	0	163	523	1196	3161
Chi phí bán hàng###Selling Expenses	313	296	0	0	127	13	73	34	37
Chi phí quản lý doanh nghiệp###Managing Expenses	23135	18199	25070	15805	21768	19371	26812	27367	25464
Lợi nhuận thuần từ hoạt động kinh doanh###Net Profit from Operating activities	-6908	7384	-16150	-6269	-4312	-3884	19524	3357	21817
Thu nhập khác###Other incomes	31019	6474	61187	1124	5155	4972	1335	29612	12852
Chi phí khác###Other Expenses	9873	66	21860	481	4572	392	1098	0	11
Lợi nhuận khác###Other profits	21146	6408	39328	644	583	4580	237	29612	12842
Tổng lợi nhuận kế toán trước thuế###Total profit before tax	14238	13793	23177	-5625	-3729	696	19761	32969	34658
Chi phí thuế TNDN###Corporate Income Tax Expenses	2862	2784	2489	0	825	239	5215	8242	8741
Chi phí thuế TNDN###Corporate Income Tax Expenses	2862	2784	2489	0	825	239	5215	8242	8741
Chi phí thuế TNDN###Corporate Income Tax Expenses	0	0	0	0	0	0	0	0	0
Lợi nhuận sau thuế thu nhập doanh nghiệp###Profit after Corporate Income Tax	11376	11008	20688	-5625	-4554	456	14547	24727	25917
---Cac Chi So Tai Chinh---									
EBITDA	0.00	0.00	0.00	0.00	0.00	0.00	0.00	0.00	0.00
Giá giao dịch cuối quý###Last Price of Quarter	6.96	5.09	5.71	0.00	0.00	0.00	0.00	0.00	0.00
