CAN DOI KE TOAN	 2019	 2018	 2017	 2016	Q4 2016	Q3 2016	 2015	Q4 2015	 2014
Tài sản ngắn hạn###Current Assets	121193	92219	95760	75069	75069	77252	120605	120605	46175
Tiền và các khoản tương đương tiền###Cash and Cash Euivalents	43395	19634	64958	60736	60736	49537	88841	88841	16091
Các khoản đầu tư tài chính ngắn hạn###Short term financial investment	0	0	15000	2500	2500	0	0	0	0
Các khoản phải thu ngắn hạn###Short term Account Receivables	67344	61616	2972	1977	1977	10555	1415	1415	1750
Hàng tồn kho###Inventory	9660	9088	10177	9033	9033	16048	28550	28550	27465
Tài sản ngắn hạn khác###Other Current Assets	794	1881	2653	823	823	1112	1800	1800	868
Tài sản dài hạn###Non-current Assets	51974	61692	71999	82331	82331	86293	91313	91313	82501
Các khoản phải thu dài hạn###Long term Account Receivable	300	300	300	0	0	0	0	0	0
Tài sản cố định ###Fixed assets	24929	33317	37713	44337	44337	50485	55377	55377	47114
Tài sản cố định hữu hình - Giá trị hao mòn lũy kế	-46210	-40911	-35804	-32116	-32116	-30850	-26427	-26427	-21318
Tài sản cố định thuê tài chính - Giá trị hao mòn lũy kế	0	0	0	0	0	0	0	0	0
Tài sản cố định vô hình - Giá trị hao mòn lũy kế	-9311	-8470	-7263	-4745	-4745	-4422	-2928	-2928	-506
Lợi thế thương mại	0	0	0	0	0	0	0	0	0
Bất động sản đầu tư ###Real Estate Investment	0	0	0	0	0	0	0	0	0
Các khoản đầu tư tài chính dài hạn###Long term Finacial Investments	0	0	0	0	0	0	0	0	0
Tài sản dài hạn khác###Other long term assets	26107	28075	32854	37664	37664	35807	35936	35936	35387
TỔNG CỘNG TÀI SẢN ###TOTAL ASSETS	173166	153911	167759	157400	157400	163545	211918	211918	128676
Nợ phải trả ###Liabilities	23176	22826	32534	44444	44444	51774	131709	131709	50430
Nợ ngắn hạn###Short term Liabilities	16501	14789	20159	28888	28888	40285	114559	114559	43899
Nợ dài hạn###Long term Liabilities	6676	8037	12375	15556	15556	11490	17150	17150	6531
Dự phòng nghiệp vụ	0	0	0	0	0	0	0	0	0
No khac	0	0	0	0	0	0	0	0	0
Vốn chủ sở hữu ###Owners equity	149990	131085	135225	112956	112956	111771	80209	80209	78246
Nguồn kinh phí và quỹ khác###Expenditures and Other Funds	0	0	0	0	0	0	0	0	0
Vốn chủ sở hữu ###Owners equity	149990	131085	135225	112956	112956	111771	80209	80209	78246
Lợi ích của cổ đông thiểu số	0	0	0	0	0	0	0	0	0
TỔNG CỘNG NGUỒN VỐN ###TOTAL EQUITY	0	0	0	0	0	0	0	0	0



KET QUA KINH DOANH	 2019	 2018	 2017	 2016	Q4 2016	 2015
Tổng doanh thu hoạt động kinh doanh###Gross Sale Revenues	267355	224835	331262	398432	87450	374539
Các khoản giảm trừ doanh thu###Deduction revenues	55	216	20819	22856	5887	0
Doanh thu thuần###Net Sales	267300	224618	310443	375576	81563	374539
Giá vốn hàng bán###Cost of goods sold	211002	194077	192327	255316	57941	277885
Lợi nhuận gộp###Gross profit	56298	30541	118116	120260	23622	96655
Doanh thu hoạt động tài chính###Financial activities Revenues	928	1328	3017	958	576	607
Chi phí tài chính###Financial Expenses	17	15	2	110	0	157
Chi phí bán hàng###Selling Expenses	3094	3486	65142	58988	12633	50497
Chi phí quản lý doanh nghiệp###Managing Expenses	18348	21267	15056	21547	9815	14205
Lợi nhuận thuần từ hoạt động kinh doanh###Net Profit from Operating activities	35767	7102	40933	40574	1749	32403
Thu nhập khác###Other incomes	0	27	1	1684	0	537
Chi phí khác###Other Expenses	76	253	452	463	250	122
Lợi nhuận khác###Other profits	-76	-226	-451	1220	-249	414
Tổng lợi nhuận kế toán trước thuế###Total profit before tax	35691	6876	40483	41794	1500	32817
Chi phí thuế TNDN###Corporate Income Tax Expenses	7211	1441	8391	8392	315	7384
Chi phí thuế TNDN###Corporate Income Tax Expenses	7411	1139	7935	9766	-117	7384
Chi phí thuế TNDN###Corporate Income Tax Expenses	-200	302	457	-1374	432	0
Lợi nhuận sau thuế thu nhập doanh nghiệp###Profit after Corporate Income Tax	28480	5435	32091	33402	1185	25433
---Cac Chi So Tai Chinh---						
EBITDA	0.00	0.00	0.00	0.00	0.00	0.00
Giá giao dịch cuối quý###Last Price of Quarter	24.00	14.17	24.13	9.98	9.98	0.00
