CAN DOI KE TOAN	Q2 2020	Q1 2020	 2019	Q4 2019	Q3 2019	Q2 2019	Q1 2019	 2018	Q4 2018	Q3 2018	Q2 2018	 2017	 2016
Tài sản ngắn hạn###Current Assets	109889	107302	112863	113082	95534	86072	77322	85072	83657	71072	65492	80172	39758
Tiền và các khoản tương đương tiền###Cash and Cash Euivalents	596	1854	2597	2597	4213	6186	1502	1386	1386	1534	2266	1687	3028
Các khoản đầu tư tài chính ngắn hạn###Short term financial investment	0	0	0	0	0	0	12000	0	0	0	0	0	0
Các khoản phải thu ngắn hạn###Short term Account Receivables	84168	83168	89644	89862	68004	58432	39811	58306	58444	44011	41793	58846	19073
Hàng tồn kho###Inventory	25027	22248	20562	20562	23268	21391	24010	25299	23819	25319	21219	19571	17454
Tài sản ngắn hạn khác###Other Current Assets	98	33	60	60	49	63	0	81	8	208	214	68	203
Tài sản dài hạn###Non-current Assets	7273	5703	5661	5661	5214	5191	5407	5454	5527	2988	2996	2575	553
Các khoản phải thu dài hạn###Long term Account Receivable	0	0	0	0	0	0	0	0	0	0	0	0	0
Tài sản cố định ###Fixed assets	3768	4138	4473	4473	4331	4424	4727	4766	4766	2332	2385	2069	356
Tài sản cố định hữu hình - Giá trị hao mòn lũy kế	-5316	-4952	-4580	-4580	-4228	-3896	-4577	-4230	-4230	-4372	-4162	-3805	-3388
Tài sản cố định thuê tài chính - Giá trị hao mòn lũy kế	0	0	0	0	0	0	0	0	0	0	0	0	0
Tài sản cố định vô hình - Giá trị hao mòn lũy kế	-110	-105	-100	-100	-94	-89	-84	-79	-79	-71	-63	-49	-34
Lợi thế thương mại	0	0	0	0	0	0	0	0	0	0	0	0	0
Bất động sản đầu tư ###Real Estate Investment	0	0	0	0	0	0	0	0	0	0	0	0	0
Các khoản đầu tư tài chính dài hạn###Long term Finacial Investments	0	0	0	0	0	0	0	0	0	0	0	0	0
Tài sản dài hạn khác###Other long term assets	2443	1565	1187	1187	883	767	680	687	760	656	611	506	197
TỔNG CỘNG TÀI SẢN ###TOTAL ASSETS	117162	113005	118524	118743	100748	91263	82729	90526	89184	74060	68487	82747	40311
Nợ phải trả ###Liabilities	37868	31376	41837	42032	30279	27630	18071	24092	22633	14419	11854	52424	15081
Nợ ngắn hạn###Short term Liabilities	36874	31376	41837	42032	30279	27630	18071	24092	22633	14419	11854	52424	15081
Nợ dài hạn###Long term Liabilities	994	0	0	0	0	0	0	0	0	0	0	0	0
Dự phòng nghiệp vụ	0	0	0	0	0	0	0	0	0	0	0	0	0
No khac	0	0	0	0	0	0	0	0	0	0	0	0	0
Vốn chủ sở hữu ###Owners equity	79294	81629	76688	76711	70469	63633	64658	66434	66551	59641	56633	30323	25230
Nguồn kinh phí và quỹ khác###Expenditures and Other Funds	0	0	0	0	53	0	0	0	0	0	0	0	0
Vốn chủ sở hữu ###Owners equity	79294	81629	76688	76711	70416	63633	64658	66434	66551	59641	56633	30323	25230
Lợi ích của cổ đông thiểu số	0	0	0	0	0	0	0	0	0	0	0	0	0
TỔNG CỘNG NGUỒN VỐN ###TOTAL EQUITY	0	0	0	0	0	0	0	0	0	0	0	0	0



KET QUA KINH DOANH	Q2 2020	Q1 2020	 2019	Q4 2019	Q3 2019	Q2 2019	Q1 2019	 2018	Q4 2018	Q3 2018	Q2 2018	 2017	 2016
Tổng doanh thu hoạt động kinh doanh###Gross Sale Revenues	43095	48057	248796	91545	58591	50274	48386	221644	78348	143296	42417	181982	125840
Các khoản giảm trừ doanh thu###Deduction revenues	110	141	1838	876	277	346	339	982	192	790	494	438	2475
Doanh thu thuần###Net Sales	42985	47916	246958	90669	58314	49928	48047	220662	78157	142506	41923	181544	123365
Giá vốn hàng bán###Cost of goods sold	36752	40354	206028	74113	48041	42765	41085	193677	67440	126284	37082	158447	112111
Lợi nhuận gộp###Gross profit	6232	7562	40930	16556	10273	7162	6963	26986	10716	16222	4840	23097	11254
Doanh thu hoạt động tài chính###Financial activities Revenues	275	262	838	276	276	262	24	789	367	422	47	539	156
Chi phí tài chính###Financial Expenses	239	13	19	0	1	8	11	458	39	419	174	113	69
Chi phí bán hàng###Selling Expenses	835	945	5502	1661	1348	1213	1280	5330	1442	3841	1344	5420	2447
Chi phí quản lý doanh nghiệp###Managing Expenses	916	1318	5577	1375	1154	1648	1400	4716	1357	3213	1265	4074	4022
Lợi nhuận thuần từ hoạt động kinh doanh###Net Profit from Operating activities	4517	5549	30671	13796	8046	4555	4297	17270	8246	9171	2103	14029	4871
Thu nhập khác###Other incomes	903	632	1591	337	473	493	288	2919	400	2519	2348	301	227
Chi phí khác###Other Expenses	0	0	39	6	0	33	0	1	0	1	0	2448	194
Lợi nhuận khác###Other profits	903	632	1552	331	473	460	288	2918	400	2518	2348	-2147	33
Tổng lợi nhuận kế toán trước thuế###Total profit before tax	5420	6181	32223	14127	8519	5015	4585	20188	8646	11690	4452	11882	4904
Chi phí thuế TNDN###Corporate Income Tax Expenses	1092	1239	6526	2833	1736	1040	917	4078	1735	2372	907	2604	1208
Chi phí thuế TNDN###Corporate Income Tax Expenses	1092	1239	6526	2833	1736	1040	917	4078	1735	2372	907	2604	1208
Chi phí thuế TNDN###Corporate Income Tax Expenses	0	0	0	0	0	0	0	0	0	0	0	0	0
Lợi nhuận sau thuế thu nhập doanh nghiệp###Profit after Corporate Income Tax	4329	4942	25697	11294	6783	3975	3668	16111	6910	9318	3545	9278	3696
---Cac Chi So Tai Chinh---													
EBITDA	0.45	0.38	1.04	1.04	1.48	1.88	2.31	0.00	0.00	0.00	0.00	0.00	0.00
Giá giao dịch cuối quý###Last Price of Quarter	16.14	10.22	10.96	10.96	9.74	9.25	9.58	0.00	0.00	0.00	0.00	0.00	0.00
