CAN DOI KE TOAN	 2019	 2018	 2017	 2016	 2015	Q4 2015	 2014	Q4 2014	 2013	Q4 2013	 2012
Tài sản ngắn hạn###Current Assets	152097	159166	138115	106932	107268	107268	78611	78611	67325	67325	44722
Tiền và các khoản tương đương tiền###Cash and Cash Euivalents	26639	6853	7006	10836	4094	4094	4639	4639	7795	7795	2514
Các khoản đầu tư tài chính ngắn hạn###Short term financial investment	0	0	0	0	0	0	1200	1200	0	0	0
Các khoản phải thu ngắn hạn###Short term Account Receivables	79201	103709	89828	69747	67352	67352	49129	49129	42350	42350	28746
Hàng tồn kho###Inventory	46258	48604	41281	26349	35822	35822	21256	21256	15982	15982	12441
Tài sản ngắn hạn khác###Other Current Assets	0	0	0	0	0	0	2387	2387	1198	1198	1021
Tài sản dài hạn###Non-current Assets	75502	58974	61004	57716	45958	45958	36275	36275	7506	7506	8139
Các khoản phải thu dài hạn###Long term Account Receivable	0	0	0	3505	5239	5239	0	0	0	0	0
Tài sản cố định ###Fixed assets	37039	42452	45607	50865	38062	38062	31036	3054	4001	4001	5189
Tài sản cố định hữu hình - Giá trị hao mòn lũy kế	-39026	-33545	-28157	-23491	-18770	-18770	-17864	-17864	-16760	-16760	-15861
Tài sản cố định thuê tài chính - Giá trị hao mòn lũy kế	0	0	0	0	0	0	0	0	0	0	0
Tài sản cố định vô hình - Giá trị hao mòn lũy kế	-1470	-1337	-1205	-1073	-941	-941	-851	-851	-851	-851	-851
Lợi thế thương mại	0	0	0	0	0	0	0	0	0	0	0
Bất động sản đầu tư ###Real Estate Investment	0	0	0	0	0	0	0	0	0	0	0
Các khoản đầu tư tài chính dài hạn###Long term Finacial Investments	7936	7936	7936	0	0	0	5239	5239	3505	3505	2950
Tài sản dài hạn khác###Other long term assets	9589	8586	7461	3345	2657	2657	0	0	0	0	0
TỔNG CỘNG TÀI SẢN ###TOTAL ASSETS	227599	218140	199119	164648	153226	153226	114886	114886	74832	74832	52861
Nợ phải trả ###Liabilities	57422	61246	50861	41066	51287	51287	47235	47235	22781	22781	18384
Nợ ngắn hạn###Short term Liabilities	57422	61150	46706	29182	44074	44074	37900	37900	22521	22521	17415
Nợ dài hạn###Long term Liabilities	0	96	4156	11884	7214	7214	9336	9336	260	260	969
Dự phòng nghiệp vụ	0	0	0	0	0	0	0	0	0	0	0
No khac	0	0	0	0	0	0	0	0	0	0	0
Vốn chủ sở hữu ###Owners equity	170177	156894	148258	123582	101939	101939	67651	67651	52051	52051	34477
Nguồn kinh phí và quỹ khác###Expenditures and Other Funds	0	0	0	0	0	0	0	0	0	-4	116
Vốn chủ sở hữu ###Owners equity	170177	156894	148258	123582	101939	101939	67651	67651	52051	52055	34361
Lợi ích của cổ đông thiểu số	0	0	0	0	0	0	0	0	0	0	0
TỔNG CỘNG NGUỒN VỐN ###TOTAL EQUITY	0	0	0	0	0	0	0	0	0	0	0



KET QUA KINH DOANH	 2019	 2018	 2017	 2016	 2015	 2014	 2013	 2012
Tổng doanh thu hoạt động kinh doanh###Gross Sale Revenues	195956	194772	196531	167652	219307	154670	143966	124178
Các khoản giảm trừ doanh thu###Deduction revenues	433	351	380	0	0	0	0	0
Doanh thu thuần###Net Sales	195523	194421	196151	167652	219307	154670	143966	124178
Giá vốn hàng bán###Cost of goods sold	143197	149617	140997	119490	152150	115157	108153	94134
Lợi nhuận gộp###Gross profit	52326	44804	55153	48161	67156	39513	35813	30044
Doanh thu hoạt động tài chính###Financial activities Revenues	682	372	817	472	234	17	27	80
Chi phí tài chính###Financial Expenses	2877	1909	2514	2956	4340	1840	1668	2574
Chi phí bán hàng###Selling Expenses	4014	5654	4554	3466	5962	4681	3014	3004
Chi phí quản lý doanh nghiệp###Managing Expenses	15852	10328	11353	9693	7817	5002	4243	4239
Lợi nhuận thuần từ hoạt động kinh doanh###Net Profit from Operating activities	30264	27285	37549	32518	49272	28008	26916	20306
Thu nhập khác###Other incomes	0	37	492	63	167	65	378	316
Chi phí khác###Other Expenses	2	0	18	66	41	8	29	47
Lợi nhuận khác###Other profits	-2	37	474	-3	126	57	350	269
Tổng lợi nhuận kế toán trước thuế###Total profit before tax	30263	27322	38023	32515	49398	28065	27265	20575
Chi phí thuế TNDN###Corporate Income Tax Expenses	3854	1570	1834	1919	5700	6204	6819	3634
Chi phí thuế TNDN###Corporate Income Tax Expenses	3854	1570	1834	1919	5700	6204	6819	3634
Chi phí thuế TNDN###Corporate Income Tax Expenses	0	0	0	0	0	0	0	0
Lợi nhuận sau thuế thu nhập doanh nghiệp###Profit after Corporate Income Tax	26409	25752	36189	30596	43698	21861	20446	16941
---Cac Chi So Tai Chinh---								
EBITDA	0.00	0.00	0.00	0.00	0.00	0.00	0.00	0.00
Giá giao dịch cuối quý###Last Price of Quarter	41.01	51.45	43.74	0.00	0.00	0.00	0.00	0.00
