CAN DOI KE TOAN	Q2 2020	Q1 2020	 2019	Q4 2019	Q3 2019	Q2 2019	Q1 2019	 2018	Q4 2018	Q3 2018	Q2 2018	Q1 2018	 2017	Q4 2017	 2016	 2015	 2014	 2013	 2012
Tài sản ngắn hạn###Current Assets	432762	358029	403685	403685	391337	355385	379686	365947	365947	377469	301017	304986	257032	259257	194610	164797	112583	95689	89713
Tiền và các khoản tương đương tiền###Cash and Cash Euivalents	112942	56059	20732	20732	40163	36984	37603	27102	27102	11819	27136	38415	53472	53472	39	0	0	0	0
Các khoản đầu tư tài chính ngắn hạn###Short term financial investment	0	0	0	0	0	0	0	0	0	0	0	0	0	0	0	0	0	0	0
Các khoản phải thu ngắn hạn###Short term Account Receivables	159037	178357	132984	132984	154421	141506	116203	36420	36420	101507	66051	86531	18866	21090	35782	3868	17062	10239	7633
Hàng tồn kho###Inventory	157193	117678	237362	237362	186206	167738	223698	296409	296409	263283	206916	176589	182113	182113	157862	160104	95019	83789	82080
Tài sản ngắn hạn khác###Other Current Assets	3591	5935	12607	12607	10548	9157	2182	6016	6016	860	914	3451	2581	2581	927	826	503	1661	0
Tài sản dài hạn###Non-current Assets	227518	224371	231864	231864	223309	230608	210938	218507	218507	218971	222891	230296	237980	237980	97801	99225	94445	124901	156754
Các khoản phải thu dài hạn###Long term Account Receivable	0	0	0	0	0	0	0	0	0	0	0	0	0	0	0	0	0	0	0
Tài sản cố định ###Fixed assets	112032	110453	114144	114144	112985	115922	120842	125990	125990	127920	129915	135047	140254	140254	91140	95091	93762	124019	156754
Tài sản cố định hữu hình - Giá trị hao mòn lũy kế	-132924	-132924	-127603	-127603	-122365	-117100	-111885	-106682	-106682	-101569	-96410	-91180	-85853	-26360	-12230	-113399	-97784	-63120	-28633
Tài sản cố định thuê tài chính - Giá trị hao mòn lũy kế	0	0	0	0	0	0	0	0	0	0	0	0	0	0	0	0	0	0	0
Tài sản cố định vô hình - Giá trị hao mòn lũy kế	-343	-343	-324	-324	-305	-287	-268	-249	-249	-243	-243	-243	-243	-243	-126	-192	-38	0	0
Lợi thế thương mại	0	0	0	0	0	0	0	0	0	0	0	0	0	0	0	0	0	0	0
Bất động sản đầu tư ###Real Estate Investment	0	0	0	0	0	0	0	0	0	0	0	0	0	0	0	0	0	0	0
Các khoản đầu tư tài chính dài hạn###Long term Finacial Investments	0	0	0	0	0	0	0	0	0	0	0	0	0	0	0	0	0	0	0
Tài sản dài hạn khác###Other long term assets	92286	92676	99858	99858	99872	104574	80148	82776	82776	84658	87156	89566	92088	92088	1221	1483	583	882	0
TỔNG CỘNG TÀI SẢN ###TOTAL ASSETS	660280	582400	635549	635549	614647	585993	590624	584454	584454	596440	523908	535283	495012	497237	292411	264022	207028	220590	246467
Nợ phải trả ###Liabilities	207663	144424	218276	218276	217250	208877	160160	174890	174890	208442	154510	184568	152961	153431	97693	264022	207028	220590	246467
Nợ ngắn hạn###Short term Liabilities	197898	136354	212004	212004	216857	208877	160160	174890	174890	208442	154510	184568	152961	153431	97693	39557	21407	23816	14945
Nợ dài hạn###Long term Liabilities	9765	8070	6272	6272	393	0	0	0	0	0	0	0	0	0	0	224465	185622	196774	231523
Dự phòng nghiệp vụ	0	0	0	0	0	0	0	0	0	0	0	0	0	0	0	0	0	0	0
No khac	0	0	0	0	0	0	0	0	0	0	0	0	0	0	0	0	0	0	0
Vốn chủ sở hữu ###Owners equity	452617	437975	417272	417272	397397	377116	430465	409564	409564	387998	369398	350714	342050	343805	194718	0	0	0	0
Nguồn kinh phí và quỹ khác###Expenditures and Other Funds	184	351	1	1	500	500	750	0	0	0	0	0	0	0	0	0	0	0	0
Vốn chủ sở hữu ###Owners equity	452433	437625	417272	417272	396897	376616	429715	409564	409564	387998	369398	350714	342050	343805	194718	0	0	0	0
Lợi ích của cổ đông thiểu số	0	0	0	0	0	0	0	0	0	0	0	0	0	0	0	0	0	0	0
TỔNG CỘNG NGUỒN VỐN ###TOTAL EQUITY	0	0	0	0	0	0	0	0	0	0	0	0	0	0	0	0	0	0	0



KET QUA KINH DOANH	Q2 2020	Q1 2020	 2019	Q4 2019	Q3 2019	Q2 2019	Q1 2019	 2018	Q4 2018	Q3 2018	Q2 2018	Q1 2018	Q4 2017	 2016	 2015	 2014	 2013
Tổng doanh thu hoạt động kinh doanh###Gross Sale Revenues	320133	493858	1945097	468450	445284	539504	543099	1805645	459679	399689	458478	487799	273369	1444565	968295	904949	856197
Các khoản giảm trừ doanh thu###Deduction revenues	0	157	0	0	3855	28842	18543	16863	6546	3179	3118	4020	1113	185	16237	15605	13146
Doanh thu thuần###Net Sales	320133	493701	1945097	468450	441429	510661	524556	1788781	453133	396509	455359	483780	272256	1444380	952058	889343	843051
Giá vốn hàng bán###Cost of goods sold	250264	385444	1523470	359406	332210	411475	420379	1456940	363286	317776	374045	401833	228385	1268042	651732	609652	587902
Lợi nhuận gộp###Gross profit	69869	108256	421627	109044	109219	99187	104177	331841	89847	78733	81315	81946	43871	176338	300327	279692	255150
Doanh thu hoạt động tài chính###Financial activities Revenues	444	15	156	23	33	47	53	258	32	62	32	132	90	112	626	401	273
Chi phí tài chính###Financial Expenses	474	741	3286	852	836	835	762	2487	977	826	504	181	21	7127	27690	28087	22432
Chi phí bán hàng###Selling Expenses	33933	56614	224329	61752	63991	49965	48621	150275	39379	41609	44403	24884	15898	54266	166597	156098	146748
Chi phí quản lý doanh nghiệp###Managing Expenses	10273	17179	55011	10878	9964	13807	20362	44526	12159	4837	4118	23412	4403	19499	28511	22968	17308
Lợi nhuận thuần từ hoạt động kinh doanh###Net Profit from Operating activities	25632	33738	139158	35585	34461	34628	34484	134811	37363	31524	32322	33602	23639	95558	78154	72940	68934
Thu nhập khác###Other incomes	16	822	28	0	0	8	20	46	16	6	24	0	0	9	3	0	1
Chi phí khác###Other Expenses	0	0	0	0	0	0	0	39	-532	0	108	462	1	54	0	0	0
Lợi nhuận khác###Other profits	16	822	27	0	0	8	20	7	547	6	-84	-462	-1	-46	3	0	1
Tổng lợi nhuận kế toán trước thuế###Total profit before tax	25648	34560	139185	35585	34461	34635	34504	134818	37911	31530	32238	33140	23639	95513	78157	72941	68935
Chi phí thuế TNDN###Corporate Income Tax Expenses	5130	6912	27837	7117	6892	6927	6901	26964	7582	6306	6448	6628	4728	19103	17195	16047	17234
Chi phí thuế TNDN###Corporate Income Tax Expenses	5130	6912	27837	7117	6892	6927	6901	26964	7582	6306	6448	6628	4728	19103	17195	16047	17234
Chi phí thuế TNDN###Corporate Income Tax Expenses	0	0	0	0	0	0	0	0	0	0	0	0	0	0	0	0	0
Lợi nhuận sau thuế thu nhập doanh nghiệp###Profit after Corporate Income Tax	20519	27648	111348	28468	27569	27708	27603	107855	30329	25224	25790	26512	18911	76410	60963	56894	51701
---Cac Chi So Tai Chinh---																	
EBITDA	0.00	0.00	0.00	0.00	0.00	0.00	0.00	0.00	0.00	0.00	0.00	0.00	0.00	0.00	0.00	0.00	0.00
Giá giao dịch cuối quý###Last Price of Quarter	19.07	17.10	23.12	23.12	19.52	20.51	19.72	20.46	20.46	17.42	16.76	18.90	21.86	0.00	0.00	0.00	0.00
