CAN DOI KE TOAN	 2019	 2018	 2017	 2016	 2015	Q4 2015	 2014	Q4 2014	 2013	Q4 2013	 2012	Q4 2012	 2011	Q4 2011	 2010	Q4 2010	 2009	Q4 2009
Tài sản ngắn hạn###Current Assets	2302	2050	2075	20268	35789	35789	37104	37104	32743	32743	39674	39674	56715	56715	56416	56416	56907	56907
Tiền và các khoản tương đương tiền###Cash and Cash Euivalents	300	94	182	13999	763	763	1785	1785	1472	1472	10878	10878	25925	25925	38661	38661	29605	29605
Các khoản đầu tư tài chính ngắn hạn###Short term financial investment	0	0	0	0	700	700	700	700	0	0	0	0	0	0	0	0	0	0
Các khoản phải thu ngắn hạn###Short term Account Receivables	1384	1336	1270	5008	28028	28028	23493	23493	20695	20695	16214	16214	12313	12313	6560	6560	17580	17580
Hàng tồn kho###Inventory	6	6	6	386	2727	2727	6287	6287	7324	7324	8541	8541	12906	12906	6398	6398	5666	5666
Tài sản ngắn hạn khác###Other Current Assets	612	615	617	875	3571	3571	4839	4839	3253	3253	4041	4041	5572	5572	4797	4797	4056	4056
Tài sản dài hạn###Non-current Assets	80	120	166	273	141	141	286	286	490	490	930	930	1217	1217	1801	1801	2485	2485
Các khoản phải thu dài hạn###Long term Account Receivable	0	0	0	0	0	0	0	0	0	0	0	0	0	0	0	0	0	0
Tài sản cố định ###Fixed assets	80	120	160	224	141	141	286	286	490	490	847	847	1217	1217	1801	1801	2485	2485
Tài sản cố định hữu hình - Giá trị hao mòn lũy kế	-19706	-19667	-19627	-20931	-28954	-28954	-28808	-28808	-28604	-28604	-31154	-31154	-30771	-30771	-30187	-30187	-29414	-29414
Tài sản cố định thuê tài chính - Giá trị hao mòn lũy kế	0	0	0	0	0	0	0	0	0	0	0	0	0	0	0	0	0	0
Tài sản cố định vô hình - Giá trị hao mòn lũy kế	0	0	0	0	0	0	0	0	0	0	0	0	0	0	0	0	0	0
Lợi thế thương mại	0	0	0	0	0	0	0	0	0	0	0	0	0	0	0	0	0	0
Bất động sản đầu tư ###Real Estate Investment	0	0	0	0	0	0	0	0	0	0	0	0	0	0	0	0	0	0
Các khoản đầu tư tài chính dài hạn###Long term Finacial Investments	0	0	0	0	0	0	0	0	0	0	0	0	0	0	0	0	0	0
Tài sản dài hạn khác###Other long term assets	0	0	7	48	0	0	0	0	0	0	82	82	0	0	0	0	0	0
TỔNG CỘNG TÀI SẢN ###TOTAL ASSETS	2382	2170	2241	20541	35930	35930	37390	37390	33233	33233	40604	40604	57932	57932	58217	58217	59392	59392
Nợ phải trả ###Liabilities	33338	33002	32270	36888	40666	40666	33464	33464	16738	16738	15076	15076	33046	33046	33636	33636	35779	35779
Nợ ngắn hạn###Short term Liabilities	16268	15932	15200	36888	38547	38547	32291	32291	16738	16738	13934	13934	31904	31904	32597	32597	34291	34291
Nợ dài hạn###Long term Liabilities	17070	17070	17070	0	2118	2118	1173	1173	0	0	1142	1142	1142	1142	1038	1038	1488	1488
Dự phòng nghiệp vụ	0	0	0	0	0	0	0	0	0	0	0	0	0	0	0	0	0	0
No khac	0	0	0	0	0	0	0	0	0	0	0	0	0	0	0	0	0	0
Vốn chủ sở hữu ###Owners equity	-30956	-30832	-30028	-16347	-4736	-4736	3927	3927	16495	16495	25527	25527	24885	24885	24581	24581	23613	23613
Nguồn kinh phí và quỹ khác###Expenditures and Other Funds	0	0	0	0	0	0	0	0	0	0	0	0	0	0	0	0	0	0
Vốn chủ sở hữu ###Owners equity	-30956	-30832	-30028	-16347	-4736	-4736	3927	3927	16495	16495	25527	25527	24885	24885	24581	24581	23613	23613
Lợi ích của cổ đông thiểu số	0	0	0	0	0	0	0	0	0	0	0	0	0	0	0	0	0	0
TỔNG CỘNG NGUỒN VỐN ###TOTAL EQUITY	0	0	0	0	0	0	0	0	0	0	0	0	0	0	0	0	0	0



KET QUA KINH DOANH	 2019	 2018	 2017	 2016	 2015	 2014	 2013	 2012	 2011	 2010	 2009
Tổng doanh thu hoạt động kinh doanh###Gross Sale Revenues	6528	6047	5411	10626	99831	98443	85992	114850	101242	102495	104184
Các khoản giảm trừ doanh thu###Deduction revenues	0	0	0	0	0	0	0	10	0	29	0
Doanh thu thuần###Net Sales	6528	6047	5411	10626	99831	98443	85992	114840	101242	102466	104184
Giá vốn hàng bán###Cost of goods sold	0	327	380	2891	96807	98538	83618	101683	91796	93505	93783
Lợi nhuận gộp###Gross profit	6528	5720	5031	7735	3024	-95	2374	13157	9446	8960	10401
Doanh thu hoạt động tài chính###Financial activities Revenues	0	0	1	307	1038	277	529	605	3680	5339	2283
Chi phí tài chính###Financial Expenses	324	324	329	774	915	334	143	722	0	0	0
Chi phí bán hàng###Selling Expenses	0	0	0	52	1933	1900	1530	2082	1708	1759	2173
Chi phí quản lý doanh nghiệp###Managing Expenses	5970	6144	17592	37533	9336	9111	9726	8958	7415	6694	6783
Lợi nhuận thuần từ hoạt động kinh doanh###Net Profit from Operating activities	234	-747	-12889	-30317	-8122	-11163	-8497	2000	4003	5846	3727
Thu nhập khác###Other incomes	0	1	777	3610	257	187	1595	843	768	247	462
Chi phí khác###Other Expenses	358	58	1569	905	797	6	3	663	4	0	3
Lợi nhuận khác###Other profits	-358	-56	-792	2705	-540	181	1591	180	764	247	459
Tổng lợi nhuận kế toán trước thuế###Total profit before tax	-124	-804	-13681	-27612	-8662	-10982	-6905	2181	4768	6094	4186
Chi phí thuế TNDN###Corporate Income Tax Expenses	0	0	0	0	0	0	91	-921	1259	1031	568
Chi phí thuế TNDN###Corporate Income Tax Expenses	0	0	0	0	0	0	8	-1003	1259	1031	568
Chi phí thuế TNDN###Corporate Income Tax Expenses	0	0	0	0	0	0	82	82	0	0	0
Lợi nhuận sau thuế thu nhập doanh nghiệp###Profit after Corporate Income Tax	-124	-804	-13681	-27612	-8662	-10982	-6996	3101	3509	5062	3618
---Cac Chi So Tai Chinh---											
EBITDA	0.00	0.00	0.00	0.00	0.00	0.00	0.00	0.00	0.00	0.00	0.00
Giá giao dịch cuối quý###Last Price of Quarter	4.00	2.90	6.10	10.10	12.50	7.20	3.60	1.23	0.84	1.75	0.00
