CAN DOI KE TOAN	 2019	 2018	 2017	 2016	 2015	Q4 2015	 2014	Q4 2014	 2013	Q4 2013	 2012	Q4 2012	 2011	Q4 2011	 2010	Q4 2010	 2009	Q4 2009
Tài sản ngắn hạn###Current Assets	324479	1100599	1643939	1389405	1511390	1511390	1303374	1303374	582843	582843	401104	401104	179306	179306	280956	280956	120812	120812
Tiền và các khoản tương đương tiền###Cash and Cash Euivalents	10260	32107	76478	4550	6759	6759	42120	42120	91579	91579	110212	110212	18384	18384	37659	37659	1550	1550
Các khoản đầu tư tài chính ngắn hạn###Short term financial investment	46090	694355	1376036	1076232	1310602	1310602	885285	885285	276230	276230	16962	16962	0	0	63109	63109	0	0
Các khoản phải thu ngắn hạn###Short term Account Receivables	29077	26858	98085	155981	85570	85570	99352	99352	64520	64520	72922	72922	56040	56040	29258	29258	61456	61456
Hàng tồn kho###Inventory	225301	319332	76474	142779	106579	106579	253527	253527	136901	136901	184347	184347	97562	97562	132900	132900	54222	54222
Tài sản ngắn hạn khác###Other Current Assets	13750	27947	16867	9862	1882	1882	23091	23091	13613	13613	16662	16662	7320	7320	18030	18030	3584	3584
Tài sản dài hạn###Non-current Assets	51686	72198	91477	99897	62819	62819	65894	65894	67338	67338	71365	71365	79594	79594	82149	82149	89301	89301
Các khoản phải thu dài hạn###Long term Account Receivable	0	1069	72	72	0	0	0	0	0	0	0	0	0	0	0	0	0	0
Tài sản cố định ###Fixed assets	48458	67900	89495	82361	59379	59379	63977	63255	65438	64828	70313	70313	75649	75649	81380	81380	88558	88558
Tài sản cố định hữu hình - Giá trị hao mòn lũy kế	-161383	-142478	-113887	-82076	-71407	-71407	-62975	-62975	-55173	-55173	-47381	-47381	-38013	-38013	-29644	-29644	-21539	-21539
Tài sản cố định thuê tài chính - Giá trị hao mòn lũy kế	0	0	0	0	0	0	0	0	0	0	0	0	0	0	0	0	0	0
Tài sản cố định vô hình - Giá trị hao mòn lũy kế	-1873	-1580	-1458	-1336	-1215	-1215	-1093	-1093	-971	-971	-892	-892	-770	-770	-645	-645	-511	-511
Lợi thế thương mại	0	0	0	0	0	0	0	0	0	0	0	0	0	0	0	0	0	0
Bất động sản đầu tư ###Real Estate Investment	0	0	0	0	0	0	0	0	0	0	0	0	0	0	0	0	0	0
Các khoản đầu tư tài chính dài hạn###Long term Finacial Investments	0	0	0	0	0	0	175	175	175	175	175	175	175	175	175	175	175	175
Tài sản dài hạn khác###Other long term assets	1612	2868	1887	2744	3440	3440	1741	1741	1725	1725	877	877	533	533	594	594	568	568
TỔNG CỘNG TÀI SẢN ###TOTAL ASSETS	376164	1172797	1735416	1489302	1574210	1574210	1369268	1369268	650181	650181	472469	472469	258900	258900	363105	363105	210113	210113
Nợ phải trả ###Liabilities	250328	1046115	1606491	1364406	1468123	1468123	1262650	1262650	544663	544663	367572	367572	151610	151610	255002	255002	104472	104472
Nợ ngắn hạn###Short term Liabilities	250328	1046115	1606491	1364406	1468123	1468123	1262650	1262650	544663	544663	367572	367572	151610	151610	255002	255002	104472	104472
Nợ dài hạn###Long term Liabilities	0	0	0	0	0	0	0	0	0	0	0	0	0	0	0	0	0	0
Dự phòng nghiệp vụ	0	0	0	0	0	0	0	0	0	0	0	0	0	0	0	0	0	0
No khac	0	0	0	0	0	0	0	0	0	0	0	0	0	0	0	0	0	0
Vốn chủ sở hữu ###Owners equity	125837	126682	128925	124897	106086	106086	106618	106618	105518	105518	104896	104896	107290	107290	108103	108103	105641	105641
Nguồn kinh phí và quỹ khác###Expenditures and Other Funds	0	0	0	0	0	0	0	0	0	0	0	0	0	0	0	0	0	0
Vốn chủ sở hữu ###Owners equity	125837	126682	128925	124897	106086	106086	106618	106618	105518	105518	104896	104896	107290	107290	108103	108103	105641	105641
Lợi ích của cổ đông thiểu số	0	0	0	0	0	0	0	0	0	0	0	0	0	0	0	0	0	0
TỔNG CỘNG NGUỒN VỐN ###TOTAL EQUITY	0	0	0	0	0	0	0	0	0	0	0	0	0	0	0	0	0	0



KET QUA KINH DOANH	 2019	 2018	 2017	 2016	 2015	 2014	 2013	 2012	 2011	 2010	 2009
Tổng doanh thu hoạt động kinh doanh###Gross Sale Revenues	153457	1168427	1881603	1709695	1371535	1185929	1080792	513767	499627	459291	389971
Các khoản giảm trừ doanh thu###Deduction revenues	23	0	0	21	0	0	0	0	0	0	0
Doanh thu thuần###Net Sales	153434	1168427	1881603	1709674	1371535	1185929	1080792	513767	499627	459291	389971
Giá vốn hàng bán###Cost of goods sold	144951	1159278	1847757	1667898	1348441	1182544	1082906	505070	482918	443715	387466
Lợi nhuận gộp###Gross profit	8483	9150	33847	41776	23094	3385	-2114	8697	16709	15576	2505
Doanh thu hoạt động tài chính###Financial activities Revenues	20035	76911	85185	84895	60278	38430	22104	7541	9396	1710	15040
Chi phí tài chính###Financial Expenses	34149	62853	75001	80445	70901	32434	12837	11214	21703	11678	10467
Chi phí bán hàng###Selling Expenses	3006	3649	5248	4034	1554	1371	1007	970	727	669	742
Chi phí quản lý doanh nghiệp###Managing Expenses	7833	8859	17873	20541	8630	6757	5483	3772	3164	2590	2662
Lợi nhuận thuần từ hoạt động kinh doanh###Net Profit from Operating activities	-16470	10698	20909	21651	2287	1253	663	283	511	2349	3673
Thu nhập khác###Other incomes	18554	307	308	0	99	551	97	102	100	10217	765
Chi phí khác###Other Expenses	1050	0	1577	26	221	559	57	148	109	10216	618
Lợi nhuận khác###Other profits	17504	307	-1270	-26	-121	-8	39	-46	-9	1	148
Tổng lợi nhuận kế toán trước thuế###Total profit before tax	1034	11005	19639	21625	2166	1244	702	237	503	2350	3821
Chi phí thuế TNDN###Corporate Income Tax Expenses	332	2255	3511	2674	684	103	80	50	14	305	2480
Chi phí thuế TNDN###Corporate Income Tax Expenses	332	2255	3511	2674	684	103	80	50	14	305	2480
Chi phí thuế TNDN###Corporate Income Tax Expenses	0	0	0	0	0	0	0	0	0	0	0
Lợi nhuận sau thuế thu nhập doanh nghiệp###Profit after Corporate Income Tax	702	8750	16128	18950	1482	1142	622	187	488	2044	1341
---Cac Chi So Tai Chinh---											
EBITDA	0.00	0.00	0.00	0.00	0.00	0.00	0.00	0.00	0.00	0.00	0.00
Giá giao dịch cuối quý###Last Price of Quarter	5.80	5.27	5.40	7.06	2.49	1.97	1.25	2.10	1.05	3.42	2.91
