CAN DOI KE TOAN	 2019	 2018	 2017	 2016	Q4 2016	 2015	Q4 2015	 2014	Q4 2014	 2013	Q4 2013	 2012	Q4 2012	 2011	Q4 2011	 2010	Q4 2010	 2009	Q4 2009
Tài sản ngắn hạn###Current Assets	113356	72474	68248	45196	45196	53587	53587	35010	35010	36481	36481	33112	33112	22974	22974	31264	31264	25967	25967
Tiền và các khoản tương đương tiền###Cash and Cash Euivalents	37970	898	7414	653	653	35388	35388	23242	23242	21609	21609	21043	21043	11896	11896	16001	16001	18392	18392
Các khoản đầu tư tài chính ngắn hạn###Short term financial investment	0	0	0	0	0	0	0	0	0	0	0	800	800	0	0	0	0	0	0
Các khoản phải thu ngắn hạn###Short term Account Receivables	62532	56195	48474	25040	25040	6833	6833	3474	3474	5446	5446	3527	3527	3967	3967	7898	7898	3406	3406
Hàng tồn kho###Inventory	12353	13930	11327	17917	17917	9810	9810	7115	7115	8259	8259	6902	6902	6297	6297	6651	6651	3514	3514
Tài sản ngắn hạn khác###Other Current Assets	501	1451	1033	1586	1586	1556	1556	1179	1179	1167	1167	840	840	814	814	714	714	656	656
Tài sản dài hạn###Non-current Assets	150393	159529	166526	176854	176854	40197	40197	29967	29967	24346	24346	26097	26097	31410	31410	25989	25989	26398	26398
Các khoản phải thu dài hạn###Long term Account Receivable	0	0	0	0	0	0	0	0	0	0	0	0	0	0	0	0	0	0	0
Tài sản cố định ###Fixed assets	40407	49927	58848	60612	60612	18571	18571	23779	18209	19991	14856	19162	14402	16793	16793	9933	9933	13277	13277
Tài sản cố định hữu hình - Giá trị hao mòn lũy kế	-91099	-81577	-70080	-62214	-62214	-56583	-56583	-53991	-53991	-51144	-51144	-50701	-50701	-47614	-47614	-43851	-43851	-41033	-41033
Tài sản cố định thuê tài chính - Giá trị hao mòn lũy kế	0	0	0	0	0	0	0	0	0	0	0	0	0	0	0	0	0	0	0
Tài sản cố định vô hình - Giá trị hao mòn lũy kế	-264	0	0	0	0	0	0	0	0	0	0	0	0	0	0	0	0	0	0
Lợi thế thương mại	0	0	0	0	0	0	0	0	0	0	0	0	0	0	0	0	0	0	0
Bất động sản đầu tư ###Real Estate Investment	0	0	0	0	4853	0	0	0	0	0	0	0	0	0	0	0	0	0	0
Các khoản đầu tư tài chính dài hạn###Long term Finacial Investments	90899	93829	93829	93829	93829	0	0	0	0	0	0	0	0	0	0	0	0	0	0
Tài sản dài hạn khác###Other long term assets	17745	14938	13014	17560	17560	14356	14356	6188	6188	4355	4355	6935	6935	9819	9819	11147	11147	13121	13121
TỔNG CỘNG TÀI SẢN ###TOTAL ASSETS	263749	232003	234774	222050	222050	93784	93784	64977	64977	60828	60828	59209	59209	54384	54384	57253	57253	52365	52365
Nợ phải trả ###Liabilities	92594	77060	79606	66870	66870	39702	39702	20891	20891	21412	21412	24506	24506	24285	24285	27716	27716	27337	27337
Nợ ngắn hạn###Short term Liabilities	82347	70718	62610	55043	55043	29346	29346	15296	15296	16076	16076	19347	19347	16382	16382	18572	18572	18836	18836
Nợ dài hạn###Long term Liabilities	10246	6342	16996	11827	11827	10356	10356	5595	5595	5337	5337	5159	5159	7903	7903	9144	9144	8500	8500
Dự phòng nghiệp vụ	0	0	0	0	0	0	0	0	0	0	0	0	0	0	0	0	0	0	0
No khac	0	0	0	0	0	0	0	0	0	0	0	0	0	0	0	0	0	0	0
Vốn chủ sở hữu ###Owners equity	171155	154944	155168	155180	155180	54082	54082	44086	44086	39415	39415	34703	34703	30099	30099	29537	29537	25028	25028
Nguồn kinh phí và quỹ khác###Expenditures and Other Funds	0	0	0	0	0	0	0	0	0	0	0	0	0	0	0	0	0	0	0
Vốn chủ sở hữu ###Owners equity	171155	154944	155168	155180	155180	54082	54082	44086	44086	39415	39415	34703	34703	30099	30099	29537	29537	25028	25028
Lợi ích của cổ đông thiểu số	0	0	0	0	0	0	0	0	0	0	0	0	0	0	0	0	0	0	0
TỔNG CỘNG NGUỒN VỐN ###TOTAL EQUITY	0	0	0	0	0	0	0	0	0	0	0	0	0	0	0	0	0	0	0



KET QUA KINH DOANH	 2019	 2018	 2017	 2016	 2015	 2014	 2013	 2012	 2011	Q3 2011	Q2 2011	Q1 2011	 2010	Q3 2010	Q2 2010	 2009
Tổng doanh thu hoạt động kinh doanh###Gross Sale Revenues	301300	217001	215189	189126	166462	140938	132560	128648	104106	30376	28361	23846	101643	29270	31181	82156
Các khoản giảm trừ doanh thu###Deduction revenues	11307	112	3764	631	2728	4318	1933	1266	3785	1024	1584	927	4959	1523	1687	3476
Doanh thu thuần###Net Sales	289993	216889	211425	188495	163733	136619	130627	127382	100321	29352	26778	22918	96684	27747	29494	78680
Giá vốn hàng bán###Cost of goods sold	166922	162891	158811	167978	108607	88732	88962	89271	70975	20328	18555	17563	66493	18933	19451	52432
Lợi nhuận gộp###Gross profit	123071	53998	52614	20517	55127	47887	41664	38111	29347	9024	8223	5355	30191	8813	10043	26248
Doanh thu hoạt động tài chính###Financial activities Revenues	294	8	9	247	1156	761	973	1314	1215	246	268	150	1439	375	308	652
Chi phí tài chính###Financial Expenses	5188	3677	4629	980	178	216	242	802	1678	452	426	476	1955	408	456	1130
Chi phí bán hàng###Selling Expenses	80652	39283	35317	2119	27965	28433	22345	20558	15692	4653	4187	2874	14521	4223	4568	14203
Chi phí quản lý doanh nghiệp###Managing Expenses	18790	11190	14432	16913	15633	9217	9263	7878	6203	1832	1697	1166	7040	2068	2420	5219
Lợi nhuận thuần từ hoạt động kinh doanh###Net Profit from Operating activities	18735	-144	-1754	753	12508	10782	10787	10187	6989	2333	2180	989	8115	2489	2907	6349
Thu nhập khác###Other incomes	2016	1345	3561	4707	1780	2023	1515	1430	960	481	188	94	646	210	195	464
Chi phí khác###Other Expenses	487	906	1664	1406	1313	332	283	320	195	13	21	11	130	35	42	84
Lợi nhuận khác###Other profits	1530	439	1896	3301	467	1692	1231	1110	765	467	167	84	516	175	152	379
Tổng lợi nhuận kế toán trước thuế###Total profit before tax	20264	295	142	4054	12975	12474	12019	11298	7754	2801	2347	1073	8631	2664	3060	6728
Chi phí thuế TNDN###Corporate Income Tax Expenses	4053	519	153	1142	2624	2506	1547	956	909	253	229	196	956	221	234	795
Chi phí thuế TNDN###Corporate Income Tax Expenses	4053	519	153	1142	2624	2506	1547	956	909	253	229	196	956	221	234	795
Chi phí thuế TNDN###Corporate Income Tax Expenses	0	0	0	0	0	0	0	0	0	0	0	0	0	0	0	0
Lợi nhuận sau thuế thu nhập doanh nghiệp###Profit after Corporate Income Tax	16212	-224	-11	2912	10351	9968	10471	10342	6845	2548	2118	877	7675	2443	2826	5933
---Cac Chi So Tai Chinh---																
EBITDA	0.00	0.00	0.00	0.00	0.00	0.00	0.00	0.00	0.00	0.00	0.00	0.00	0.00	0.00	0.00	0.00
Giá giao dịch cuối quý###Last Price of Quarter	18.90	15.20	31.00	14.50	12.93	2.25	1.60	1.22	0.45	0.50	0.84	0.84	2.03	2.03	0.00	0.00
