CAN DOI KE TOAN	 2019	 2018	 2017	 2016	Q4 2016	 2015	Q4 2015	 2014	Q4 2014	 2013	Q4 2013	 2012	Q4 2012	 2011	Q4 2011	 2010	Q4 2010	 2009	Q4 2009
Tài sản ngắn hạn###Current Assets	58868	50142	36016	31960	31960	26061	26061	24360	24360	21599	21599	24548	24548	21564	21564	21285	21285	23492	23492
Tiền và các khoản tương đương tiền###Cash and Cash Euivalents	9312	9826	8085	5194	5194	5533	5533	6952	6952	5577	5577	13042	13042	6728	6728	8595	8595	8258	8258
Các khoản đầu tư tài chính ngắn hạn###Short term financial investment	37500	24500	16500	9500	9500	6500	6500	6500	6500	6000	6000	0	0	0	0	0	0	0	0
Các khoản phải thu ngắn hạn###Short term Account Receivables	3535	7509	4073	9726	9726	7276	7276	5243	5243	4853	4853	5225	5225	8621	8621	7089	7089	7718	7718
Hàng tồn kho###Inventory	8491	8218	7333	7483	7483	6406	6406	4652	4652	3507	3507	4992	4992	4150	4150	3760	3760	5449	5449
Tài sản ngắn hạn khác###Other Current Assets	29	89	25	58	58	345	345	1013	1013	1662	1662	1288	1288	2065	2065	1840	1840	2066	2066
Tài sản dài hạn###Non-current Assets	7170	8012	8948	9009	9009	8245	8245	7944	7944	8795	8795	10118	10118	11102	11102	11858	11858	7342	7342
Các khoản phải thu dài hạn###Long term Account Receivable	350	350	350	350	350	250	250	0	0	0	0	0	0	0	0	0	0	0	0
Tài sản cố định ###Fixed assets	6716	7616	8525	8520	8520	6803	6803	7522	7522	8289	8289	9156	9156	10109	10109	10919	10919	6489	6489
Tài sản cố định hữu hình - Giá trị hao mòn lũy kế	-9165	-8256	-7315	-6795	-6795	-7209	-7209	-6842	-6842	-6337	-6337	-5750	-5750	-4914	-4914	-4021	-4021	-3408	-3408
Tài sản cố định thuê tài chính - Giá trị hao mòn lũy kế	0	0	0	0	0	0	0	0	0	0	0	0	0	0	0	0	0	0	0
Tài sản cố định vô hình - Giá trị hao mòn lũy kế	-8	0	0	0	0	0	0	0	0	0	0	0	0	0	0	0	0	0	0
Lợi thế thương mại	0	0	0	0	0	0	0	0	0	0	0	0	0	0	0	0	0	0	0
Bất động sản đầu tư ###Real Estate Investment	0	0	0	0	0	0	1104	0	0	0	0	0	0	0	0	0	0	0	0
Các khoản đầu tư tài chính dài hạn###Long term Finacial Investments	0	0	0	0	0	0	0	0	0	0	0	512	512	572	572	572	572	327	327
Tài sản dài hạn khác###Other long term assets	104	46	73	139	139	89	89	422	422	506	506	450	450	421	421	367	367	526	526
TỔNG CỘNG TÀI SẢN ###TOTAL ASSETS	66038	58154	44964	40969	40969	34307	34307	32304	32304	30394	30394	34666	34666	32666	32666	33143	33143	30833	30833
Nợ phải trả ###Liabilities	24972	23643	16431	16022	16022	12370	12370	11205	11205	9918	9918	15240	15240	14185	14185	15138	15138	13982	13982
Nợ ngắn hạn###Short term Liabilities	24972	23643	16431	16022	16022	12370	12370	8107	8107	8397	8397	12599	12599	11547	11547	12381	12381	13830	13830
Nợ dài hạn###Long term Liabilities	0	0	0	0	0	0	0	3097	3097	1520	1520	2640	2640	2638	2638	2757	2757	152	152
Dự phòng nghiệp vụ	0	0	0	0	0	0	0	0	0	0	0	0	0	0	0	0	0	0	0
No khac	0	0	0	0	0	0	0	0	0	0	0	0	0	0	0	0	0	0	0
Vốn chủ sở hữu ###Owners equity	41066	34511	28533	24947	24947	21937	21937	21099	21099	20477	20477	19426	19426	18481	18481	18005	18005	16852	16852
Nguồn kinh phí và quỹ khác###Expenditures and Other Funds	0	0	0	0	0	0	0	0	0	0	0	0	0	0	0	0	0	0	0
Vốn chủ sở hữu ###Owners equity	41066	34511	28533	24947	24947	21937	21937	21099	21099	20477	20477	19426	19426	18481	18481	18005	18005	16852	16852
Lợi ích của cổ đông thiểu số	0	0	0	0	0	0	0	0	0	0	0	0	0	0	0	0	0	0	0
TỔNG CỘNG NGUỒN VỐN ###TOTAL EQUITY	0	0	0	0	0	0	0	0	0	0	0	0	0	0	0	0	0	0	0



KET QUA KINH DOANH	 2019	 2018	 2017	 2016	 2015	 2014	 2013	 2012	 2011	 2010	 2009
Tổng doanh thu hoạt động kinh doanh###Gross Sale Revenues	213491	164810	147914	124776	108033	93742	90804	78913	99350	79993	78981
Các khoản giảm trừ doanh thu###Deduction revenues	0	0	0	46	0	0	160	445	0	0	159
Doanh thu thuần###Net Sales	213491	164810	147914	124730	108033	93742	90644	78469	99350	79993	78822
Giá vốn hàng bán###Cost of goods sold	175717	134623	123055	106006	92291	79405	75527	67212	86542	71585	67914
Lợi nhuận gộp###Gross profit	37774	30187	24859	18724	15742	14337	15117	11257	12808	8408	10907
Doanh thu hoạt động tài chính###Financial activities Revenues	2144	1624	1025	795	870	754	931	1110	850	1257	126
Chi phí tài chính###Financial Expenses	0	0	0	0	0	0	0	0	0	0	37
Chi phí bán hàng###Selling Expenses	0	0	0	0	0	0	0	0	0	4	63
Chi phí quản lý doanh nghiệp###Managing Expenses	19794	16447	15211	12200	12283	10982	11401	9513	9959	9542	8870
Lợi nhuận thuần từ hoạt động kinh doanh###Net Profit from Operating activities	20125	15365	10673	7320	4329	4110	4647	2854	3700	119	2063
Thu nhập khác###Other incomes	37	246	563	251	274	365	175	858	143	5464	299
Chi phí khác###Other Expenses	105	61	158	0	13	0	138	60	832	1556	127
Lợi nhuận khác###Other profits	-68	186	405	251	260	365	37	798	-689	3908	172
Tổng lợi nhuận kế toán trước thuế###Total profit before tax	20057	15550	11078	7570	4589	4474	4684	3652	3011	4027	2235
Chi phí thuế TNDN###Corporate Income Tax Expenses	4097	3085	2281	1508	880	972	1026	600	257	1263	196
Chi phí thuế TNDN###Corporate Income Tax Expenses	4097	3085	2281	1508	848	972	962	576	376	1263	196
Chi phí thuế TNDN###Corporate Income Tax Expenses	0	0	0	0	32	0	64	24	-119	0	0
Lợi nhuận sau thuế thu nhập doanh nghiệp###Profit after Corporate Income Tax	15960	12466	8797	6063	3709	3502	3659	3052	2754	2764	2039
---Cac Chi So Tai Chinh---											
EBITDA	0.00	0.00	0.00	0.00	0.00	0.00	0.00	0.00	0.00	0.00	0.00
Giá giao dịch cuối quý###Last Price of Quarter	54.75	0.71	0.30	0.16	0.12	0.09	0.16	0.08	0.05	0.04	0.00
