CAN DOI KE TOAN	 2019	 2018	 2017	 2016	 2015	 2014	 2013
Tài sản ngắn hạn###Current Assets	96884	112375	91828	88282	76208	62349	56037
Tiền và các khoản tương đương tiền###Cash and Cash Euivalents	9818	20789	52606	71164	67169	39826	29158
Các khoản đầu tư tài chính ngắn hạn###Short term financial investment	27000	44000	12000	0	0	0	0
Các khoản phải thu ngắn hạn###Short term Account Receivables	59541	47449	25681	16608	8187	21604	23280
Hàng tồn kho###Inventory	111	137	1180	364	706	910	3536
Tài sản ngắn hạn khác###Other Current Assets	414	0	361	146	147	8	63
Tài sản dài hạn###Non-current Assets	38174	7943	7448	6778	6438	7230	7397
Các khoản phải thu dài hạn###Long term Account Receivable	0	0	0	0	0	0	0
Tài sản cố định ###Fixed assets	6665	7809	7240	5918	6253	6588	6757
Tài sản cố định hữu hình - Giá trị hao mòn lũy kế	-4607	-3359	-2876	-2553	-2219	-1884	-1502
Tài sản cố định thuê tài chính - Giá trị hao mòn lũy kế	0	0	0	0	0	0	0
Tài sản cố định vô hình - Giá trị hao mòn lũy kế	0	0	0	0	0	0	0
Lợi thế thương mại	0	0	0	0	0	0	0
Bất động sản đầu tư ###Real Estate Investment	0	0	0	0	0	0	0
Các khoản đầu tư tài chính dài hạn###Long term Finacial Investments	0	0	0	0	0	0	0
Tài sản dài hạn khác###Other long term assets	160	134	74	94	185	642	640
TỔNG CỘNG TÀI SẢN ###TOTAL ASSETS	135058	120318	99276	95060	82646	69578	63434
Nợ phải trả ###Liabilities	33741	26090	14847	12393	9885	8155	11713
Nợ ngắn hạn###Short term Liabilities	33741	26090	14847	12393	9885	8155	11713
Nợ dài hạn###Long term Liabilities	0	0	0	0	0	0	0
Dự phòng nghiệp vụ	0	0	0	0	0	0	0
No khac	0	0	0	0	0	0	0
Vốn chủ sở hữu ###Owners equity	101317	94227	84429	82667	72761	61423	51721
Nguồn kinh phí và quỹ khác###Expenditures and Other Funds	0	0	0	0	0	0	0
Vốn chủ sở hữu ###Owners equity	101317	94227	84429	82667	72761	61423	51721
Lợi ích của cổ đông thiểu số	0	0	0	0	0	0	0
TỔNG CỘNG NGUỒN VỐN ###TOTAL EQUITY	0	0	0	0	0	0	0



KET QUA KINH DOANH	 2019	 2018	Q3 2018	 2017	Q3 2017	 2016	 2015	 2014
Tổng doanh thu hoạt động kinh doanh###Gross Sale Revenues	112247	91886	20399	90503	23904	81059	70459	60811
Các khoản giảm trừ doanh thu###Deduction revenues	0	0	0	0	0	0	0	0
Doanh thu thuần###Net Sales	112247	91886	20399	90503	23904	81059	70459	60811
Giá vốn hàng bán###Cost of goods sold	83847	62416	13903	60375	16030	51995	43030	37361
Lợi nhuận gộp###Gross profit	28399	29470	6496	30128	7874	29064	27429	23450
Doanh thu hoạt động tài chính###Financial activities Revenues	3164	3518	815	3345	830	3068	2270	1499
Chi phí tài chính###Financial Expenses	34	8	0	0	0	0	0	0
Chi phí bán hàng###Selling Expenses	0	0	0	0	0	0	0	0
Chi phí quản lý doanh nghiệp###Managing Expenses	11482	10707	2302	10546	2779	9789	10087	8486
Lợi nhuận thuần từ hoạt động kinh doanh###Net Profit from Operating activities	20047	22273	5008	22927	5925	22343	19613	16464
Thu nhập khác###Other incomes	4	173	173	0	0	0	0	0
Chi phí khác###Other Expenses	0	54	0	122	3	16	0	12
Lợi nhuận khác###Other profits	4	119	173	-122	-3	-16	0	-12
Tổng lợi nhuận kế toán trước thuế###Total profit before tax	20051	22393	5182	22805	5922	22326	19613	16452
Chi phí thuế TNDN###Corporate Income Tax Expenses	4040	4512	1036	4772	1184	4493	4338	3643
Chi phí thuế TNDN###Corporate Income Tax Expenses	4040	4512	1036	4772	1184	4493	4338	3643
Chi phí thuế TNDN###Corporate Income Tax Expenses	0	0	0	0	0	0	0	0
Lợi nhuận sau thuế thu nhập doanh nghiệp###Profit after Corporate Income Tax	16011	17880	4145	18033	4737	17834	15275	12809
---Cac Chi So Tai Chinh---								
EBITDA	0.00	0.00	0.00	0.00	0.00	0.00	0.00	0.00
Giá giao dịch cuối quý###Last Price of Quarter	23.99	18.41	0.00	0.00	0.00	0.00	0.00	0.00
